id,bid,user_id,用户昵称,微博正文,头条文章url,发布位置,艾特用户,话题,转发数,评论数,点赞数,发布时间,发布工具,微博图片url,微博视频url,retweet_id,ip,user_authentication
5020201210610102,O8twB2yIm,1273252391,婺源长溪村村长戴向阳,当今农村，留守老人成为了一个社会问题。我国60岁及以上人口达2.87亿，其中留守老人己超过1亿人。这些留守老人大多生活在农村，由于子女外出打工或工作，他们无法得到及时的照顾和关爱，生活质量普遍较低。一方面政府和社会组织多关爱留守老人，为他们提供必要的生活补贴和医疗保障；子女也要经常通过电话、视频等方式，与留守老人保持联系，帮助他们缓解孤独感，帮助他们解决经济上的困难，为他们提供更好的生活条件和保障。#农村留守老人的生活状态#,,上饶·长溪村,,农村留守老人的生活状态,0,0,0,2024-04-06 16:38,荣耀50 SE 5G,"https://wx3.sinaimg.cn/large/4be44a27gy1hoh78bizelj22c0340u10.jpg,https://wx1.sinaimg.cn/large/4be44a27gy1hoh78nk13pj22c0340qv9.jpg,https://wx2.sinaimg.cn/large/4be44a27gy1hoh78rcqxcj22c03404qt.jpg,https://wx1.sinaimg.cn/large/4be44a27gy1hoh78tqtl3j22c03407wk.jpg,https://wx4.sinaimg.cn/large/4be44a27gy1hoh78wx3czj22c03407wl.jpg,https://wx1.sinaimg.cn/large/4be44a27gy1hoh78zjjgej23402c0e85.jpg,https://wx4.sinaimg.cn/large/4be44a27gy1hoh793ht1tj22c0340npg.jpg,https://wx4.sinaimg.cn/large/4be44a27gy1hoh7968yuoj23402c0qv8.jpg,https://wx1.sinaimg.cn/large/4be44a27gy1hoh798popqj23402c0qv7.jpg",,,,普通用户
5008311163819094,O3ud6g1wi,6090404847,80Mon,#我给两会留个言#还有现在农村的现状，田地没人种，或者产量质量提不上来，变相的浪费资源，农村食品安全【假冒伪劣、仿名牌、市场监管、质量抽查、高糖高油高盐】、农村饮水安全、农村校园教育、留守儿童和留守老人，这些都是亟待解决的！#农村留守老人生活现状如何##农村留守老人的生活状态##农村留守老人生活现状如何#,,,,"我给两会留个言,农村留守老人生活现状如何,农村留守老人的生活状态",0,0,0,2024-03-04 21:11,Xiaomi MIX Fold 3,,,,,普通用户
4996290062582476,NEoWyaPOQ,7317313899,二串天花板,#农村留守老人的生活状态#农村留守老人的生活：每天天亮等天黑，天黑等天亮，周而复始。。。某博主记录奶奶在爷爷去世后的独居生活！L1024专员的微博视频,,,,农村留守老人的生活状态,0,1,4,2024-01-31 17:04,微博视频号,,"http://f.video.weibocdn.com/u0/h1yVuxnSgx08bMGaamKI01041200y4lC0E010.mp4?label=mp4_720p&template=1280x720.25.0&ori=0&ps=1BVp4ysnknHVZu&Expires=1724978667&ssig=SSAqsGh%2B%2Fy&KID=unistore,video",,,黄V
4994243678438719,NDxHVzpin,7860041270,不在就是死了,现在的生活状态就跟我的ID一样#农村留守老人的生活状态#,,,,农村留守老人的生活状态,0,0,0,2024-01-26 01:32,vivo S7e,,,,,普通用户
4990814323482057,NC6uIeBQd,6420207784,1024专员,#农村留守老人的生活状态#农村留守老人的生活：每天天亮等天黑，天黑等天亮，周而复始。。。某博主记录奶奶在爷爷去世后的独居生活！L1024专员的微博视频,,,,农村留守老人的生活状态,641,241,2705,2024-01-16 14:25,微博视频号,,"http://f.video.weibocdn.com/u0/h1yVuxnSgx08bMGaamKI01041200y4lC0E010.mp4?label=mp4_720p&template=1280x720.25.0&ori=0&ps=1BVp4ysnknHVZu&Expires=1724978667&ssig=SSAqsGh%2B%2Fy&KID=unistore,video",,,金V
