id,bid,user_id,用户昵称,微博正文,头条文章url,发布位置,艾特用户,话题,转发数,评论数,点赞数,发布时间,发布工具,微博图片url,微博视频url,retweet_id,ip,user_authentication
4996305856234383,NEpm1q9Qz,5063517446,黑心皮蛋wow,明年秋招找不到工作，去当美甲师#美甲##农村老人找不到工作也挣不到钱#,,,,"美甲,农村老人找不到工作也挣不到钱",0,5,5,2024-01-31 18:06,iPhone客户端,https://wx1.sinaimg.cn/large/005wG0cegy1hmcyvvdoxij30u0140tc6.jpg,,,,普通用户
4994440098484376,NDCOJzBaM,7860396011,Ftre-钟淇毅生,#专家称农村大量房子只造不住#专家是谁的专家呀，你要不要过年的时候来看看农村的房子有没有人住，不到过年大家能茴回来住吗，家里有工作的谁还愿意往外跑呢#农村老人找不到工作也挣不到钱#乡村振兴势在必行呀,,,,"专家称农村大量房子只造不住,农村老人找不到工作也挣不到钱",0,18,68,2024-01-26 14:32,熬夜小能手,,,,,金V
4993072495332671,ND3eVmngP,6003007144,小红-天天红1129,#农村老人找不到工作也挣不到钱#回家种地吧至少农村消费低在城市老人没养老保险日子不好过。,,,,农村老人找不到工作也挣不到钱,0,0,0,2024-01-22 19:58,iQOO Neo7,,,,,普通用户
4992932111714696,NCZAv7c4o,2487675923,朴鲁述道,#农村老人找不到工作也挣不到钱#我们无比需要一个客观的视角来仔细地看待和研究诸如此类的问题，不是困难人员慰问、给予一次性支助等非系统性的解决，而是，以一个系统化的视角，长远地思考，找到一个共赢的出路。,,,,农村老人找不到工作也挣不到钱,0,0,0,2024-01-22 10:40,微博搜索,,,,,普通用户
4992930638989216,NCZy7BIvm,1191965271,三联生活周刊,#农村老人找不到工作也挣不到钱##农村老人如何摆脱养老困境#今年62岁的春英在沈阳老家附近的公园当环卫工人，负责道路和草坪的整洁。入夏之后，沈阳的白天变得漫长而难熬，每次一出门，汗便立刻浸湿衣服，而她也只能抽空到树荫下休息。公园为环卫工人准备的休息站是两个大集装箱，没有风扇、只有小电暖气，但冬天也不太顶用，春英不得不穿着两件棉袄才能勉强御寒。老伴在公园里当保安，这两份工作每个月为两人带来4000元的收入，只要每个月休假不超过4天，每人还能额外得到100元的奖金。为了拿到这100元，春英会推掉一切不必要的活动，姊妹之间的家庭聚会也会特意安排在她的休假日进行。对春英和老伴来说，每月4200元的收入是一笔不小的数目，只靠新农保，两个人每月一共只能拿到382元的补贴，“这笔钱是很难养活自己的”。尽管春英和老伴每个月在吃喝上格外节俭，单位的食堂的午餐只需要每人每个月交30元、晚饭大多煮点青菜和鸡蛋，杂七杂八算下来，每月能够剩下的钱也不多，碰上“人情礼往”和女儿带着两个孩子回家的时候，这4200元收入“基本一点都不会剩下”。年龄和生计之间的矛盾始终困扰着农村老年人。北京大学国家发展研究院教授赵耀辉从2007年开始主持“中国健康与养老追踪调查”，项目最近的调查数据显示，70岁以上的农村户籍老年人的就业率超过了50%，这个就业率包括自己在家务农以及外出打工。这意味着依然有一半以上的高龄农村老人需要依靠劳作来维持自己的生活。厦门大学的一项研究数据显示，2020年城乡居民养老金均值仅为174元/月，不及企业职工的1/16，城乡居民如果仅靠这点养老金收入，难以保障其基本生活。而就业市场上，退休年龄则像一座分水岭，无论求职者的自我认知和身体情况如何，超龄老人很难找到合适的岗位。对老年工作者来说，阻碍他们的不只是年龄带来的准入门槛限制，即便进入工作岗位，他们面临着的往往是脏乱、简陋的工作环境和不轻的体力劳动。在双重因素作用下，许多老年人的身体开始吃不消，而他们认识到自己的衰老大多是突如其来的，这一过程往往伴随着疾病。6月，玲子的父亲来到了北京，在西三旗附近做环卫工作，为了这个难得的机会，玲子的父亲高兴了很久，来的那天，携带的衣物和被褥整整塞满了三个包。玲子的父亲负责将垃圾回收并分类，炎炎夏日里垃圾站的酸臭让人难以忍受，一想到父亲之后就要长期待在垃圾站中进行垃圾分类，玲子心里五味杂陈，她很难相信一向爱干净的父亲愿意接受这种工作条件。这份工作工资只有3600元，但能提供食宿，食堂就在垃圾站附近、住宿在阴暗且潮湿的地下室。尽管如此，父亲还是表现出了极大的热情。一场病却打断了玲子父亲的打工计划。工作第二天，父亲打电话告诉玲子母亲，自己肚子疼得无法坚持，想先回家。母亲告诉了玲子之后，玲子带父亲去医院做了检查，结果是肠梗阻。父亲在急诊病房住了三天，这期间父亲经历了一次灌肠，玲子帮助父亲清理了排泄物，整个过程中，父亲一直面对着墙壁，一言不发。为了维持生计，农村与城市中，许多满头白发的老年人仍在田间劳作，或是在城市的角落里做着环卫、保洁等零工……一面是微薄的养老金，一面是年龄限制下越来越少的工作机会，面对巨大的养老压力，他们将如何摆脱困境？节选｜农村“超龄老人”：找不到零工挣不到钱，他们害怕变老文｜方生,,,,"农村老人找不到工作也挣不到钱,农村老人如何摆脱养老困境",211,161,1274,2024-01-22 10:34,,https://wx4.sinaimg.cn/large/001iFmCjly1hm276kjjvdj60u00d6gmx02.jpg,,,,蓝V
