id,bid,user_id,用户昵称,微博正文,头条文章url,发布位置,艾特用户,话题,转发数,评论数,点赞数,发布时间,发布工具,微博图片url,微博视频url,retweet_id,ip,user_authentication
5059989475693323,OpaBdnT5N,3278934015,周周说险-西安-明亚,人老了手里不能有大钱因为会被太多人惦记，你赞成么？#李立群##李立群儿子##老人救命钱被骗##老人被骗79万元崩溃哭泣##8旬老人被骗子远程刷脸转走238万##养老金##月月领钱##养老保险##商业养老金##养老年金险##你的养老金准备好了吗?#L周周说险-西安-明亚的微博视频,,,,"李立群,李立群儿子,老人救命钱被骗,老人被骗79万元崩溃哭泣,8旬老人被骗子远程刷脸转走238万,养老金,月月领钱,养老保险,商业养老金,养老年金险,你的养老金准备好了吗?",0,0,1,2024-07-25 11:42,微博视频号,,"http://f.video.weibocdn.com/o0/4ouxRmrglx08gHcIDIuk01041200CvyB0E010.mp4?label=mp4_720p&template=720x1280.24.0&ori=0&ps=1BVp4ysnknHVZu&Expires=1726703340&ssig=hIEI0DVvjf&KID=unistore,video",,,黄V
5040004860477702,OgMHY20gS,2014058390,大理公安,急！为了咱爹妈，警叔拜托大家帮帮忙。#你我同心反诈同行##老人救命钱被骗#L深圳龙岗公安的微博视频,,,,"你我同心反诈同行,老人救命钱被骗",0,0,0,2024-05-31 08:11,微博视频号,,"http://f.video.weibocdn.com/u0/F0OSDSV7gx08f6A1XCgU01041200z4pT0E010.mp4?label=mp4_720p&template=720x1280.24.0&ori=0&ps=1BVp4ysnknHVZu&Expires=1726703340&ssig=tyF2NEdGhm&KID=unistore,video",,,蓝V
5038665979658707,OgdStEwFB,1735882701,深圳公安,急！为了咱爹妈，警叔拜托大家帮帮忙。#你我同心反诈同行##老人救命钱被骗#L深圳龙岗公安的微博视频,,,,"你我同心反诈同行,老人救命钱被骗",1,2,3,2024-05-27 15:30,微博视频号,,"http://f.video.weibocdn.com/u0/F0OSDSV7gx08f6A1XCgU01041200z4pT0E010.mp4?label=mp4_720p&template=720x1280.24.0&ori=0&ps=1BVp4ysnknHVZu&Expires=1726703340&ssig=tyF2NEdGhm&KID=unistore,video",,,蓝V
5037620923208738,OfMGUdsJQ,6133524752,固原网警,急！为了咱爹妈，警叔拜托大家帮帮忙。#你我同心反诈同行##老人救命钱被骗#L深圳龙岗公安的微博视频,,,,"你我同心反诈同行,老人救命钱被骗",0,0,0,2024-05-24 18:18,微博视频号,,"http://f.video.weibocdn.com/u0/F0OSDSV7gx08f6A1XCgU01041200z4pT0E010.mp4?label=mp4_720p&template=720x1280.24.0&ori=0&ps=1BVp4ysnknHVZu&Expires=1726703340&ssig=tyF2NEdGhm&KID=unistore,video",,,蓝V
5037581160939568,OfLEM3Wqk,1809809377,深圳龙岗公安,急！为了咱爹妈，警叔拜托大家帮帮忙。#你我同心反诈同行##老人救命钱被骗#L深圳龙岗公安的微博视频,,,,"你我同心反诈同行,老人救命钱被骗",0,1,2,2024-05-24 15:40,iPhone客户端,,"http://f.video.weibocdn.com/u0/F0OSDSV7gx08f6A1XCgU01041200z4pT0E010.mp4?label=mp4_720p&template=720x1280.24.0&ori=0&ps=1BVp4ysnknHVZu&Expires=1726703340&ssig=tyF2NEdGhm&KID=unistore,video",,,蓝V
4993772667014847,NDlsetqSH,6992314115,嬷凹咪,#老人救命钱被骗#,,,,老人救命钱被骗,0,31,14,2024-01-24 18:20,得不到的心上人,https://wx3.sinaimg.cn/large/007Dd2jVgy1hm4vybcn0uj31401o0txp.jpg,,,,金V
4957821642999136,NogcIcAda,5890965060,冰川思想库,#老人救命钱被骗#【全天下的骗子，都在围剿老人】这并不是一个智商问题，这是一个全天下骗子，集人类骗术之精华重点围剿老人的问题。O全天下的骗子，都在围剿老人,,,,老人救命钱被骗,5,1,3,2023-10-17 13:24,微博 weibo.com,,,,,黄V
4898843840479369,MFtny20HL,5214352396,城市中的奋斗精神,#揭发都市易家怎么毁灭无数个家庭#💣⚡假冒他人名义签署合同，你遇到过吗？我身边的朋友遇到了，疫情期间。⚡⚡长达在北京700多天尚峰尚水的都市易家易落京院，长期对外宣传别墅独院厂房，出租代理买卖装修房屋的幌子，大张旗鼓的在白家疃一带欺行霸市，坑骗了多少无辜老百姓血汗钱？？假用他人经纪人一人名义签定不同的合同，同伙又假用演员身份做掩护，一人分身多角色，骗得周边的老百姓叫苦连天是民怨沸腾。根据内行人透漏这家公司打一枪换一炮。游走在法律的边缘做假账。💣💣#现在微信转的5000千至今未追回#微信平台回复未检测到对方有欺骗风险。#被骗了##被骗经历##痛苦##北京爆料##骗术##今日头条##遇到过最奇葩问题##欺骗##北京头条##北京头条爆料##北京微头条##微头条##我要上微头条##今日头条微头条##头条##近期碎片##出租##租房##北京租房合租##租房骗子##房源##无中介费真房源##租房平台假房源乱象测评##租房平台假房源乱象##中介发布虚假房源坑骗租客##安居客被曝现虚假房源##中介机构虚假房源乱象##诈骗##你有哪些被骗的经历##你的那些被骗经历##生活里被骗钱的经历##微信被骗钱##微信新骗术##老人救命钱被骗##挂骗子#,,,,"揭发都市易家怎么毁灭无数个家庭,现在微信转的5000千至今未追回,被骗了,被骗经历,痛苦,北京爆料,骗术,今日头条,遇到过最奇葩问题,欺骗,北京头条,北京头条爆料,北京微头条,微头条,我要上微头条,今日头条微头条,头条,近期碎片,出租,租房,北京租房合租,租房骗子,房源,无中介费真房源,租房平台假房源乱象测评,租房平台假房源乱象,中介发布虚假房源坑骗租客,安居客被曝现虚假房源,中介机构虚假房源乱象,诈骗,你有哪些被骗的经历,你的那些被骗经历,生活里被骗钱的经历,微信被骗钱,微信新骗术,老人救命钱被骗,挂骗子",0,0,0,2023-05-07 19:27,vivo Y3标准版,https://wx2.sinaimg.cn/large/005GSTg0ly1hdq1ioc58zj30hs0n6jsi.jpg,,,,普通用户
4828605509012599,Mc09UBOAv,1411250833,dexterzhn,7.-.复制打开抖音，看看【dexterzhn的作品】#内容过:/于真实#老人被足疗店骗#华清池家...Ю92UjHJvhnTNw8ΔΔ#足疗骗局##老人救命钱被骗##华清池足疗#,,,," 内容过:/ 于真实 , 华清池 家... Ю92UjHJvhnTNw8ΔΔ ",0,0,0,2022-10-25 23:45,iPhone客户端,,,,,普通用户
4795079786763792,LDTsusnzq,5214352396,城市中的奋斗精神,💣💣##易落京院中介假用演员身份做掩护，一人分身多角色##假冒他人名义签署合同，你遇到过吗？我身边的朋友遇到了，疫情期间。⚡⚡2022年6月作落在尚峰尚水的都市易家易落京院，长期对外宣传别墅独院厂房，出租代理买卖装修房屋的幌子，大张旗鼓的在白家疃一带欺行霸市，骗了多少人都是未知数？？假用他人经纪人一人名义签定不同的合同，又假用演员身份做掩护，一人分身多角色，骗得周边的老百姓叫苦连天是民怨沸腾。#讲一个内行人才懂的梗#根据内行人透漏这家公司打一枪换一炮。游走在法律的边缘做假账。奉劝有求租房或是有买卖房屋意向的能看清它的真面目。#中介##爆料##北京爆料##北京新闻##北京新闻爆料##热点爆料##头条爆料##头条新闻##黑心中介##黑心房产中介##房产曝光台##房产中介服务标准##房产中介##房产中介未来会消失吗##被中介坑最惨的一次##你被中介套路过吗##中介套路##北京无中介租房##黑中介的套路与反套路##黑心中介还学生血汗钱##黑心商贩##黑心老板##租房疑似遇到了黑心中介##黑心经纪人渣助理##房产经纪人##房产经纪人看过来##质量不过关你能囧么办##说说你的被坑经历##花钱买教训##曝光黑心商家##我要维权##被骗##骗术曝光##骗术揭秘##最新骗术曝光##骗子##挂骗子##最新爆料##最新消息##黑心商贩##遇到骗子怎么办##中国首个骗子地图##老人救命钱被骗##无良奸商##遇到无良房产中介该如何维权##定金##警惕付定金规则陷阱##定金人的心理##谁还不是个定金人##定金人现状##定金人社死现场##进击的定金人##定金人能有多严谨##生活里被骗钱的经历##被骗钱##微信被骗钱##微信被骗##怼骗子有多解气#,,,,"讲一个内行人才懂的梗,中介,爆料,北京爆料,北京新闻,北京新闻爆料,热点爆料,头条爆料,头条新闻,黑心中介,黑心房产中介,房产曝光台,房产中介服务标准,房产中介,房产中介未来会消失吗,被中介坑最惨的一次,你被中介套路过吗,中介套路,北京无中介租房,黑中介的套路与反套路,黑心中介还学生血汗钱,黑心商贩,黑心老板,租房疑似遇到了黑心中介,黑心经纪人渣助理,房产经纪人,房产经纪人看过来,质量不过关你能囧么办,说说你的被坑经历,花钱买教训,曝光黑心商家,我要维权,被骗,骗术曝光,骗术揭秘,最新骗术曝光,骗子,挂骗子,最新爆料,最新消息,遇到骗子怎么办,中国首个骗子地图,老人救命钱被骗,无良奸商,遇到无良房产中介该如何维权,定金,警惕付定金规则陷阱,定金人的心理,谁还不是个定金人,定金人现状,定金人社死现场,进击的定金人,定金人能有多严谨,生活里被骗钱的经历,被骗钱,微信被骗钱,微信被骗,怼骗子有多解气",0,0,0,2022-07-25 11:26,vivo Y3标准版,https://wx1.sinaimg.cn/large/005GSTg0ly1h4j0f2hl5vj30k016wn11.jpg,,,,普通用户
4772261842653035,LujRmb8aT,2328007923,灰产圈_,发布了头条文章：《骗子进村，一天认了8个干爹干妈！近日，重庆市江津区人民检察院检察》#老人被骗##老人救命钱被骗##老人卖手工篮被骗收百元假钞##八旬老人5天内被骗238万##300多名老人被骗2000余万##江苏1500名老人被骗20亿##以投资墓地为由百余名老人被骗超650万元##8旬老人被骗子远程刷脸转走238万##老人与扒手分赃被骗##老人被骗汇款前被拦称被挡财路##23万老人被骗100亿##老人投资电影被骗30万##百余名老人以房养老被骗##老人被骗应该怎么办##老人养老钱被骗走牵出巨额诈骗案##老人为什么甘愿被骗##灰产圈#O骗子进村，一天认了8个干爹干妈！近日，重庆市江津区人民检察院检察,http://t.cn/A6XKzPu7,,,"老人被骗,老人救命钱被骗,老人卖手工篮被骗收百元假钞,八旬老人5天内被骗238万,300多名老人被骗2000余万,江苏1500名老人被骗20亿,以投资墓地为由百余名老人被骗超650万元,8旬老人被骗子远程刷脸转走238万,老人与扒手分赃被骗,老人被骗汇款前被拦称被挡财路,23万老人被骗100亿,老人投资电影被骗30万,百余名老人以房养老被骗,老人被骗应该怎么办,老人养老钱被骗走牵出巨额诈骗案,老人为什么甘愿被骗,灰产圈",0,1,0,2022-05-23 12:15,微博 weibo.com,,,,,黄V
4770813813983301,LtIbPgIeN,1809809377,深圳龙岗公安,关心老人就转给他看！揭秘专坑老人的保健品骗局套路#全民反诈防骗季##诈骗##老人救命钱被骗##当你发现姥姥坠入爱河#L深圳龙岗公安的微博视频,,,,"全民反诈防骗季,诈骗,老人救命钱被骗,当你发现姥姥坠入爱河",2,2,1,2022-05-19 12:21,iPhone客户端,,"http://f.video.weibocdn.com/u0/gCnf44LJgx07WaqTKv5S01041200CNF90E010.mp4?label=mp4_720p&template=720x1280.24.0&ori=0&ps=1BVp4ysnknHVZu&Expires=1726703342&ssig=pIi0QFBJkQ&KID=unistore,video",,,蓝V
4699515791610149,KFKRl6KS9,7194825193,天天鉴宝,又是一个真实的骗局，得抓紧时间给家里老人科普。#鉴宝##我爱天天鉴宝##鉴宝人的聊天方式有多好笑##翡翠##翡翠玉石##翡翠原石##翡翠手镯##缅甸翡翠##翡翠珠宝#和田玉超话#翡翠珠宝##翡翠吊坠##骗局##老人救命钱被骗#L天天鉴宝的微博视频,,,,"鉴宝,我爱天天鉴宝,鉴宝人的聊天方式有多好笑,翡翠,翡翠玉石,翡翠原石,翡翠手镯,缅甸翡翠,翡翠珠宝,翡翠吊坠,骗局,老人救命钱被骗",0,0,5,2021-11-03 18:29,微博视频号,,"http://f.video.weibocdn.com/o0/rwFZxYwglx07R3mqQEQ001041200V6iR0E010.mp4?label=mp4_720p&template=720x1280.24.0&trans_finger=0dec003e4dad885964301ff5a1db7715&ori=0&ps=1BVp4ysnknHVZu&Expires=1726703342&ssig=h%2BQE9T%2BUSI&KID=unistore,video",,,蓝V
4693041908814726,KD2rAAZ70,7511812073,寄给瑟瑟发抖的利剑,⚡💣#荣事达航空冰箱被曝虚假宣传推广三无电器#没证书，还敢拿出来对外卖，不是在作S吗？现在市场抓的这么严格，怎么还是有js沟岩惨喘的存在？最新进展！jS回复：冰箱没有能效标识是很正常的事，言外之意是不知道多少老百姓又被坑了还不自知？？⚡⚡💣荣事达牌冰箱被曝光不合格！！！2021年9月受害者在拼多多平台荣事达旗舰店购买的合肥荣事达冷柜制造有限公司的安徽省合肥市长丰双凤经济开发区，生产的荣事达牌小型冰箱，打开包装发现该冰箱刺鼻氨水甲醛气味，让人恶心头疼，与商家一番争论，结果商家回复是冰箱没有证书，没有能效标识。⚡#荣事达牌冰箱被曝光不合格##老人救命钱被骗##骗子遇上撒贝宁##遇到骗子怎么办##怼骗子有多解气##那些年恶心到我的骗子们##恶心##双十一电商恶战##伪劣家电##假冒伪劣##打击假冒伪劣产品##假货##网上买东西##网购平台里的笑点##卖假发的主播有多拼##朋友圈卖假货##微信朋友圈卖假货##记者调查直播带货卖假货##调查##造假##微商做假#,,,,"荣事达航空冰箱被曝虚假宣传推广三无电器,荣事达牌冰箱被曝光不合格,老人救命钱被骗,骗子遇上撒贝宁,遇到骗子怎么办,怼骗子有多解气,那些年恶心到我的骗子们,恶心,双十一电商恶战,伪劣家电,假冒伪劣,打击假冒伪劣产品,假货,网上买东西,网购平台里的笑点,卖假发的主播有多拼,朋友圈卖假货,微信朋友圈卖假货,记者调查直播带货卖假货,调查,造假,微商做假",0,0,0,2021-10-16 21:44,vivo Y3标准版,"https://wx1.sinaimg.cn/large/008cmNtfly1gvhhd6895vj637k1i8x6p02.jpg,https://wx3.sinaimg.cn/large/008cmNtfly1gvhhd7g9qqj60jz0xhwjz02.jpg,https://wx1.sinaimg.cn/large/008cmNtfly1gvhhdbvcfxj61i034c7wh02.jpg,https://wx2.sinaimg.cn/large/008cmNtfly1gvhhdckowbj609e0k0gn002.jpg,https://wx3.sinaimg.cn/large/008cmNtfly1gvhhddxpcij60k016w0xz02.jpg,https://wx1.sinaimg.cn/large/008cmNtfly1gvhhdfjow0j31gs1cg4gb.jpg",,,,普通用户
4635382518649016,KeQszAi0g,3973657461,愿天下无Z,简直泯灭人性，老人的钱都骗！骗子还很会规避法律责任……希望“大头明哥”能帮到他们，将骗子绳之以法！#全民反诈防骗季##老人救命钱被骗#,,,,"全民反诈防骗季,老人救命钱被骗",0,0,1,2021-05-10 19:06,小米手机,"https://wx2.sinaimg.cn/large/ecd93375ly1gqdj9m4w1uj20u01t042l.jpg,https://wx3.sinaimg.cn/large/ecd93375ly1gqdj9mojuij20u01t0ael.jpg,https://wx3.sinaimg.cn/large/ecd93375ly1gqdj9n6lhcj20u01t078p.jpg,https://wx1.sinaimg.cn/large/ecd93375ly1gqdj9nn249j20u01t0wiy.jpg",,,,普通用户
4596646182914159,JEycWce6z,5704807456,林妹儿林妹儿,前两天去医院里看爷爷看到楼道走廊上有个人被死死的绑在病床上他们都说他疯了原因是他和一个人一起住一个病房里身上仅剩的1500多块钱被偷了（他是低保户后来又生病了政府看他很可怜拨款了3000块住院的时间里几个月生活算下来才用掉了1000多块钱那剩下的1500就是他的保命钱然后他就气疯了他邻床的不承认拿了钱医院房间里又没监控医院没办法只能捆住他防止他伤害自己）冬天这么冷只有一床铺盖睡在走廊里和睡在外面无异想要给他一点钱但是他们说他现在不清醒给他钱也没用唉#老人救命钱被骗#,,,,老人救命钱被骗,0,0,1,2021-01-23 21:41,小米10,,,,,普通用户
4590346719214624,JBUkvCF8Y,5966799021,在A股没有出路的死路一条,网络诈骗害人不浅，看到一个小年轻被诈骗，最后承受不了死了！#老人救命钱被骗#,,,,老人救命钱被骗,0,0,0,2021-01-06 12:30,荣耀10 AI变色更潮美,,,,,普通用户
4579408272687974,JxjLRbhgq,5966799021,在A股没有出路的死路一条,2020年12月3日，在工地上接到别人的通知，我的父亲发生了意外，我当时懵了，之后赶紧赶往人民医院，医生已经进行了一次抢救，说不手术肯定没有希望，手术也只是有一线希望，感谢老天，手术完成了，但是我的父亲昏迷不醒，医生说至少在重症监护室里两个星期进行后续跟进治疗，看看能不能有所好转，才能进行下一部治疗，只是后续治疗费用太高，我的家庭无力承担，我们全家人的经济来源是靠我外出打工和我的父亲在家务农挣得，家中的情况只能维持正常生活，积蓄不多。在爸爸手术之后，我原本的工作已经不可能在做了，重症监护室这边需要长时间有人在，初期的治疗费大致还需要150000元，家里把能借的钱全都借了个遍，所有的钱加在一起还是远远不够，所以才发起这个筹款，恳请大家能多多伸出援手，不管是转发还是捐赠都是对我最大的帮助，谢谢,,盐城·东台市人民医院,,,2,0,0,2020-12-07 08:04,荣耀10 AI变色更潮美,"https://wx2.sinaimg.cn/large/006vO4ZTly1gleyvs5320j30rf0rf3yx.jpg,https://wx3.sinaimg.cn/large/006vO4ZTly1gleyvsvhgmj30u0140q6e.jpg,https://wx1.sinaimg.cn/large/006vO4ZTly1gleyvtdtffj30u0140gou.jpg,https://wx4.sinaimg.cn/large/006vO4ZTly1gleyvtzfluj30u0140q75.jpg,https://wx1.sinaimg.cn/large/006vO4ZTly1gleyvulirjj30u0140q60.jpg,https://wx2.sinaimg.cn/large/006vO4ZTly1gleyvvljr0j30u014041d.jpg,https://wx4.sinaimg.cn/large/006vO4ZTly1gleyvwi3cqj310y0u0gqp.jpg,https://wx4.sinaimg.cn/large/006vO4ZTly1gleyvxjmefj30u0140wl2.jpg",,,,
4579458651263412,Jxl575iFC,5966799021,在A股没有出路的死路一条,帮帮我的父亲#老人救命钱被骗#,,,,老人救命钱被骗,1,1,0,2020-12-07 11:24,荣耀10 AI变色更潮美,,,4579408272687974,,普通用户
