id,bid,user_id,用户昵称,微博正文,头条文章url,发布位置,艾特用户,话题,转发数,评论数,点赞数,发布时间,发布工具,微博图片url,微博视频url,retweet_id,ip,user_authentication
5070127120779045,Otqkg3gFf,5351288952,三真康复,发布了头条文章：《老年人摔骨折多久能走路？85岁老人用时2个月恢复独立步行》#预防老年人摔跤##骨折康复##长沙三真康复医院#人到老年，最怕的事情之一是跌倒，但最常发生的意外也是跌倒。在我国，跌倒已成为65岁以上老年人因伤致死的首位原因。跌倒危害大，主动预防很重要。但万一不幸摔伤骨折，千万不要长时间卧床静养。对老年人来说，骨折本身不“致命”，长期卧床导致的一系列并发症才可怕。骨折后，无论是选择保守治疗还是手术治疗，为了预防或减少并发症，加速功能恢复，科学的康复训练都必须跟上。O老年人摔骨折多久能走路？85岁老人用时2个月恢复独立步行,http://t.cn/A6RUX8Dz,,,"预防老年人摔跤,骨折康复,长沙三真康复医院",0,0,0,2024-08-22 11:06,微博 weibo.com,,,,湖南,普通用户
5056820983104265,OnQaKd1yN,7805888523,深圳蓝生脑科医院,发布了头条文章：《老人不慎摔倒，科学应对有妙招：深圳蓝生脑科医院骨科守护健康每一步》健康超话医院超话#健康##深圳民生##深圳医院##预防老年人摔跤##如何预防老年人摔跤#O老人不慎摔倒，科学应对有妙招：深圳蓝生脑科医院骨科守护健康每一步,http://t.cn/A68v9Rue,,,"健康,深圳民生,深圳医院,预防老年人摔跤,如何预防老年人摔跤",0,0,0,2024-07-16 17:52,微博 weibo.com,,,,广东,蓝V
4908157699097123,N3qdzCazN,1666210504,刘点意,拜登摔了个跤又在群体冷嘲热讽官媒与事业单位官号都一起幸灾乐祸如此兴师动众为此围攻真的LOW！就不能用实力说话与博弈交锋么？老年人不小心摔跤并不是他的耻辱这一群群地高潮，才真的奇耻大辱！有那时间搞这些心理阴暗的戳戳指指能不能报道一些民生实际问题啊？#还我凤凰中学##预防老年人摔跤#,,,,"还我凤凰中学,预防老年人摔跤",0,3,10,2023-06-02 12:17,vivo S15,,,,广东,黄V
4900210201856582,N05t27MYS,3127352621,北京市大兴区心康医院,【老年人跌倒后如何自救？】1、如果是背部先着地，应弯曲双腿，挪动臀部到放有毯子或垫子的椅子或床旁，然后使自己较舒适的平躺，盖好毯子，保持体温，如可能向他人寻求帮助。2、休息片刻，等体力准备充分，尽力使自己向椅子的方向翻转身体，使自己变成俯卧位。3、双手支撑地面，抬起臀部，弯曲膝关节，然后尽力使自己面向椅子跪，双手扶住椅面。4、以椅子为支撑，尽力站起来。休息片刻，打电话寻求帮助，告知家人自己跌倒。5、到医院诊治，查找跌倒原因，制定预防跌倒的措施及方案。#如何预防老年人跌倒##预防老年人摔跤#,,,,"如何预防老年人跌倒,预防老年人摔跤",0,0,0,2023-05-11 13:56,HUAWEI Mate 30 5G,https://wx4.sinaimg.cn/large/ba679d2dly1hdueh7zsjfj20kg0dmgmf.jpg,,,北京,蓝V
4890110150313565,MBOaX1jzv,1868403351,静姐姐吃的学问,老年人摔跤记住这3点，可以救命：1.下意识的用手撑地，好过屁股、头、脖子着地。手部骨折，恢复期短于大腿或者髋关节骨折。2.骨质疏松，一定要及时补钙。3.不要立即去扶，避免二次伤害，要保护好现场，打120，避免再被撞到。长期卧床容易引发泌尿系统、肺部感染，血栓。要尽可能避免。以上仅作个人经验分享，不代表医疗意见。有需要一定要及时去医院。#老年人摔倒后应当如何处理##预防老年人摔跤##骨折##老年人##健康养生#L静姐姐吃的学问的微博视频,,,,"老年人摔倒后应当如何处理,预防老年人摔跤,骨折,老年人,健康养生",0,0,8,2023-04-13 17:02,微博视频号,,"http://f.video.weibocdn.com/o0/w6sMuyRLlx084Dveh8MM01041202xx3D0E010.mp4?label=mp4_720p&template=720x1280.24.0&ori=0&ps=1BVp4ysnknHVZu&Expires=1727192315&ssig=VuU%2Fu8W2mJ&KID=unistore,video",,上海,黄V
4819802138346681,M8j8Vz1lT,5872605952,DrG科学育儿,【世界骨质疏松日】2022年世界骨松日中国主题为#巩固一生赢战骨折#。#预防老年人摔跤#老年人摔倒危害大，或危及生命？如何预防老年人摔跤？戳👇,,,,"巩固一生赢战骨折,预防老年人摔跤",110,90,214,2022-10-01 16:44,微博网页版,https://wx3.sinaimg.cn/large/006pqR4Qly1h6nk9art86j30u043z48t.jpg,,,北京,黄V
4763167983143625,LqvhQdbND,7600460174,武汉科技大学附属天佑医院,【跌倒，65岁以上老人因伤死亡首因！】在我国，跌倒是65岁以上老年人伤害死亡的首位原因。如何#预防老年人摔跤#？一旦跌倒怎样正确起身？#天佑健康小课堂#,,,,"预防老年人摔跤,天佑健康小课堂",0,0,1,2022-04-28 10:00,微博网页版,"https://wx1.sinaimg.cn/large/008imKTkgy1h1m428md92j30dc0kbgnm.jpg,https://wx4.sinaimg.cn/large/008imKTkgy1h1m4292h0bj30dc1vndmo.jpg,https://wx1.sinaimg.cn/large/008imKTkgy1h1m42agio7j30dc2ff11a.jpg",,,,蓝V
4745784128440877,Ljd3mzpRb,5972031931,智安联生活,智安联生活超话【#实用技能分享##如何预防老年人跌倒#？】65岁及以上老年人因为受伤到医疗机构就诊，很多都是跌倒受伤所致，其中创伤性骨折是最主要的就诊原因。而发生过跌倒的老年人，比没有发生过跌倒的老年人跌倒风险更高。#老年人跌倒有哪些高危因素#？怎样才能有效#预防老年人摔跤#？戳↓（央视频号：国家应急广播）L央视频的微博视频,,,,"实用技能分享,如何预防老年人跌倒,老年人跌倒有哪些高危因素,预防老年人摔跤",0,0,0,2022-03-11 10:42,智安联生活超话,,"http://f.video.weibocdn.com/WGRPmoZLlx07MSu9DwXe01041200Gpmx0E010.mp4?label=mp4_720p&template=864x486.25.0&trans_finger=775cb0ab963a74099cf9f840cd1987f1&ori=0&ps=1BVp4ysnknHVZu&Expires=1727192810&ssig=5rzooykwCm&KID=unistore,video",,,普通用户
4741598968027120,Lhsb6xGdG,1868403351,静姐姐吃的学问,老年人摔倒，记住这两点，能救命！L静姐姐吃的学问的微博视频#老人跌倒##预防老年人摔跤#,,,,"老人跌倒,预防老年人摔跤",0,0,1,2022-02-27 21:32,iPhone客户端,,"http://f.video.weibocdn.com/o0/YlWhOJRTlx07U5Rc9Hr201041202YIZk0E020.mp4?label=mp4_720p&template=720x960.24.0&ori=0&ps=1BVp4ysnknHVZu&Expires=1727192825&ssig=4vhtIFxrDQ&KID=unistore,video",,,黄V
4714318455900308,L60uhoKWg,6449205605,安馨养老,#预防老年人摔跤#老年人跌倒事不小，今天安博士为您分享老年人居家防跌倒小知识！#适老化#,,北京,,"预防老年人摔跤,适老化",0,0,0,2021-12-14 14:49,iPhone客户端,https://wx4.sinaimg.cn/large/0072scZfly1gxdd31icmrj30n0a4qb29.jpg,,,,蓝V
4696156909077488,KEltMC5t6,1893826915,春雨医生,#预防老年人摔跤#在我国，每年约有4000万65岁以上的老人跌倒，每万人中有8位老人因跌倒死亡，跌倒是我国伤害死亡的第四位原因，是我国65岁以上老年人群伤害死亡的首要原因。跌倒的原因是多种多样的，内在的身体原因及外在的环境因素都会导致跌倒的发生，对于年轻人来说，拍拍灰站起来的小事，可能就会让老年人发生骨折甚至死亡。1.尽量选择平整的地面行走，走路保持步态平稳，尽量慢走，避免走过陡的楼梯或台阶，上下楼梯、如厕时尽可能使用扶手；2.遵循3个30秒原则：起床时先侧卧30秒，然后缓慢起身，床旁坐30秒后无头晕方可站立，站立30秒后无头晕、胸闷等不适方可缓慢行走。3.穿着合适。裤子不要太长；鞋子要合脚，鞋底需防滑；尽量不穿高跟鞋或一次性纸拖鞋。4.改善居住设施。保持室内光线充足，夜间睡眠可以开小夜灯。床不宜太高（约45~50cm）。洗手间安装有扶手。保持地面干洁，关注地面是否平整，有无杂物、阶梯。如有障碍物需先移开或绕道行走，以免绊倒。5.注意用药安全。长期服用抗高血压、镇静、利尿等药物的患者应定期复查，遵医嘱服药。6.老年人可选择适当的辅助工具，使用合适长度、顶部面积较大的拐杖。将拐杖、助行器及经常使用的物件等放在触手可及的位置。7.坚持有规律的体育锻炼，可增强肌肉力量、柔韧性、协调性、平衡能力、步态稳定性和灵活性。,,,,预防老年人摔跤,3,0,4,2021-10-25 12:02,微博 weibo.com,https://wx4.sinaimg.cn/large/0024aiTply1gvrc065kftj60mi0gfq4202.jpg,,,,蓝V
4661539052720765,KpOUxbpNj,3275690554,小兰子hr,刚刚过去的五月，我们痛失了多位功勋卓著的科学家老人。在对他们致以最高的敬意的同时，一条关于#预防老年人摔跤#的话题登上了微博热搜。O网页链接,,,,预防老年人摔跤,0,0,0,2021-07-21 23:23,未通过审核应用,,,,,普通用户
4658490414469108,KoxBniKCo,7379536574,健康梧州官微,#健康源于生活细节#【如何#预防老年人摔跤#】2021年5月22日，中国工程院院士袁隆平逝世，享年91岁。据多家媒体报道，今年3月份袁老的一次意外跌倒，很可能严重影响了他的健康。65岁及以上老年人因为受伤到医疗机构就诊，很多都是跌倒受伤所致，其中创伤性骨折是最主要的就诊原因。而发生过跌倒的老年人，比没有发生过跌倒的老年人跌倒风险更高。老年人跌倒有哪些高危因素？怎样才能有效预防老年人摔跤？戳↓#想挂号却注册当了医生#来源：L央视频的微博视频,,,,"健康源于生活细节,预防老年人摔跤,想挂号却注册当了医生",0,0,0,2021-07-13 13:28,微博视频号,,"http://f.video.weibocdn.com/WGRPmoZLlx07MSu9DwXe01041200Gpmx0E010.mp4?label=mp4_720p&template=864x486.25.0&trans_finger=775cb0ab963a74099cf9f840cd1987f1&ori=0&ps=1BVp4ysnknHVZu&Expires=1727193105&ssig=%2Fqf0DZhSdm&KID=unistore,video",,,蓝V
4647921632936401,Kk6EXcjTj,7580970763,小脑萎缩共济失调知识,发布了头条文章：《神经系统疾病出现年轻化趋势，小脑萎缩位于其中》小脑萎缩共济失调中医治疗超话#共济失调##预防老年人摔跤#O神经系统疾病出现年轻化趋势，小脑萎缩位于其中,http://t.cn/A6Vg0dy8,,,"共济失调,预防老年人摔跤",0,0,0,2021-06-14 09:32,微博 weibo.com,,,,,普通用户
4646538532097942,KjwG98NLM,7424724811,橘色猫妖,刚刚过去的五月，我们痛失了多位功勋卓著的科学家老人。在对他们致以最高的敬意的同时，一条关于#预防老年人摔跤#的话题登上了微博热搜。O网页链接,,,,预防老年人摔跤,0,0,0,2021-06-10 13:56,未通过审核应用,,,,,普通用户
4640130885485568,KgPZen12U,2258778610,无锡消防,#预防老年人摔跤#【防止老年人跌倒】老年人是社会弱势群体，我们要加强对老年人的关心，特别是独居老人，自己生活时总容易发生意外。随着年龄的增加，老年人由跌倒造成伤亡的事故增多，成为常见的突发问题。如何有效防止老年人跌倒？L桂林消防119的微博视频,,无锡,,预防老年人摔跤,6,5,7,2021-05-23 21:34,iPhone客户端,,"http://f.video.weibocdn.com/0047qYPIgx07MSpLVqrK01041200x4Cb0E010.mp4?label=mp4_hd&template=640x360.25.0&trans_finger=d8257cc71422c9ad30fe69ce9523c87b&ori=0&ps=1BVp4ysnknHVZu&Expires=1727193150&ssig=MfYEolZfEf&KID=unistore,video",,,
4645464048403342,Kj4J6zg5M,6624398627,反诈宣传员小迷妹,#预防老年人摔跤#【防止老年人跌倒】老年人是社会弱势群体，我们要加强对老年人的关心，特别是独居老人，自己生活时总容易发生意外。随着年龄的增加，老年人由跌倒造成伤亡的事故增多，成为常见的突发问题。如何有效防止老年人跌倒？L桂林消防119的微博视频,,,,预防老年人摔跤,0,0,7,2021-06-07 14:46,生活百科 · 视频社区,,,4640130885485568,,普通用户
4642949570495052,Ki1jv24MI,6135644110,创建无邪乌前旗,【如何#预防老年人摔跤#】,,,,预防老年人摔跤,0,0,0,2021-05-31 16:15,微博 weibo.com,,,,,蓝V
4642847763202470,KhYFidr6K,5065571660,保定检察,【#如何预防老年人跌倒#？】65岁及以上老年人因为受伤到医疗机构就诊，很多都是跌倒受伤所致，其中创伤性骨折是最主要的就诊原因。而发生过跌倒的老年人，比没有发生过跌倒的老年人跌倒风险更高。#老年人跌倒有哪些高危因素#？怎样才能有效#预防老年人摔跤#？戳↓（央视频号：国家应急广播）L央视频的微博视频,,,,"如何预防老年人跌倒,老年人跌倒有哪些高危因素,预防老年人摔跤",6,6,7,2021-05-31 09:30,微博视频号,,"http://f.video.weibocdn.com/WGRPmoZLlx07MSu9DwXe01041200Gpmx0E010.mp4?label=mp4_720p&template=864x486.25.0&trans_finger=775cb0ab963a74099cf9f840cd1987f1&ori=0&ps=1BVp4ysnknHVZu&Expires=1727193160&ssig=533GCK8JWg&KID=unistore,video",,,蓝V
4641921907824570,KhAzYwPwK,7607968051,AONI傲拟科技,【跌倒，65岁以上老人因伤死亡首因！袁隆平院士3月曾摔跤引发不适】2021年5月22日，中国工程院院士袁隆平逝世，享年91岁。据多家媒体报道，今年3月份袁老的一次意外跌倒，很可能严重影响了他的健康。在我国，跌倒是65岁以上老年人伤害死亡的首位原因。《生命时报》邀请权威专家，告诉你如何#预防老年人摔跤#，一旦跌倒怎样正确起身。——转自《生命时报》,,,,预防老年人摔跤,0,0,0,2021-05-28 20:11,HUAWEI Mate 20,"https://wx2.sinaimg.cn/large/008iSg27ly1gqyeh4k6ekj30dc0ugq5v.jpg,https://wx1.sinaimg.cn/large/008iSg27ly1gqyeh50bpzj30dc0kbtag.jpg,https://wx1.sinaimg.cn/large/008iSg27ly1gqyeh635xtj30dc1vndmb.jpg,https://wx2.sinaimg.cn/large/008iSg27ly1gqyeh9a9grj30dc2ffqaz.jpg",,,,蓝V
4639957941225272,KgLui58Ks,7211561239,央视频,【#如何预防老年人跌倒#？】65岁及以上老年人因为受伤到医疗机构就诊，很多都是跌倒受伤所致，其中创伤性骨折是最主要的就诊原因。而发生过跌倒的老年人，比没有发生过跌倒的老年人跌倒风险更高。#老年人跌倒有哪些高危因素#？怎样才能有效#预防老年人摔跤#？戳↓（央视频号：国家应急广播）L央视频的微博视频,,,,"如何预防老年人跌倒,老年人跌倒有哪些高危因素,预防老年人摔跤",720,130,1478,2021-05-23 10:07,微博视频号,,"http://f.video.weibocdn.com/WGRPmoZLlx07MSu9DwXe01041200Gpmx0E010.mp4?label=mp4_720p&template=864x486.25.0&trans_finger=775cb0ab963a74099cf9f840cd1987f1&ori=0&ps=1BVp4ysnknHVZu&Expires=1727193164&ssig=1quCgVBN61&KID=unistore,video",,,
4641775199460094,KhwLlDH0a,1738355852,zhen713回归,怎么把钙补进骨头里？微博正文~#预防老年人摔跤#微博正文~微博正文,,,,预防老年人摔跤,0,0,1478,2021-05-28 10:28,微博 weibo.com,,,4639957941225272,,普通用户
4641732211246556,KhvE15ehK,2312983300,天使爱做梦lmq,#预防老年人摔跤#,,,,预防老年人摔跤,0,0,1478,2021-05-28 07:37,Android,,,4639957941225272,,普通用户
4641557602634805,Khr6ob3qR,1447009337,贾昀星,跌倒是我国65岁以上老人因伤死亡首因，如何预防老年意外摔倒？家里有老人的一定要收藏！#预防老年人摔跤##如何预防老年人跌倒##预防老年痴呆小妙招#,,南宁,,"预防老年人摔跤,如何预防老年人跌倒,预防老年痴呆小妙招",0,0,1,2021-05-27 20:03,麦芒6 边界，我来超越,"https://wx2.sinaimg.cn/large/563f9c39gy1gqx8lwiyqjj20u00yoq8t.jpg,https://wx3.sinaimg.cn/large/563f9c39gy1gqx8lxctaij20t80zu44c.jpg,https://wx4.sinaimg.cn/large/563f9c39gy1gqx8ly2pwmj20u00zddkg.jpg,https://wx2.sinaimg.cn/large/563f9c39gy1gqx8lz4jbhj20tm0wgte7.jpg,https://wx2.sinaimg.cn/large/563f9c39gy1gqx8lzsi3gj20u015u441.jpg,https://wx1.sinaimg.cn/large/563f9c39gy1gqx8m16na4j20u00uu43r.jpg,https://wx4.sinaimg.cn/large/001zVvehgy1gqx8m1zovyj60u019cgsh02.jpg,https://wx4.sinaimg.cn/large/563f9c39gy1gqx8m2nxdtj20u40tgdkx.jpg,https://wx1.sinaimg.cn/large/563f9c39gy1gqx8m3euogj20u80oujvl.jpg",,,,普通用户
4641522400628282,KhqbC2DrA,2881030352,双流应急,【#如何预防老年人跌倒#？】65岁及以上老年人因为受伤到医疗机构就诊，很多都是跌倒受伤所致，其中创伤性骨折是最主要的就诊原因。而发生过跌倒的老年人，比没有发生过跌倒的老年人跌倒风险更高。#老年人跌倒有哪些高危因素#？怎样才能有效#预防老年人摔跤#？戳↓来源：L央视频的微博视频,,,,"如何预防老年人跌倒,老年人跌倒有哪些高危因素,预防老年人摔跤",0,0,0,2021-05-27 17:43,iPhone客户端,,"http://f.video.weibocdn.com/WGRPmoZLlx07MSu9DwXe01041200Gpmx0E010.mp4?label=mp4_720p&template=864x486.25.0&trans_finger=775cb0ab963a74099cf9f840cd1987f1&ori=0&ps=1BVp4ysnknHVZu&Expires=1727193164&ssig=1quCgVBN61&KID=unistore,video",,,蓝V
4641477378441272,Khp0ZzpXy,6290064980,四川健康传播,#预防老年人摔跤#【专家谈健康|老年人跌倒会造成哪些伤害？如何预防？】在我国，跌倒是65岁以上老年人伤害死亡的首位原因。很多老年人就是因为跌了一跤以后，再也起不来了，只能选择卧床，而卧床以后就有各种各样的疾病，甚至在半年内，就走完了最后的生命。所以说防止老年人跌倒，非常非常重要，值得我们每一位家庭成员重视起来。那如何预防老年跌倒？戳视频L健康四川12320的微博视频,,,,预防老年人摔跤,0,0,2,2021-05-27 14:45,微博视频号,,"http://f.video.weibocdn.com/002hqvo3gx07MXExlA8g01041200BbTh0E010.mp4?label=mp4_720p&template=1280x720.25.0&trans_finger=775cb0ab963a74099cf9f840cd1987f1&ori=0&ps=1BVp4ysnknHVZu&Expires=1727193166&ssig=USIds8j5td&KID=unistore,video",,,蓝V
4641461934752246,KhoC5jWh8,7348890667,CIB烘焙技术研究所,对于身边的老人，大家有留意过他们关注面包哪些特质吗？当我们自己也步入老年时，会想吃到怎样的面包呢？随着老龄化进程的加快，烘焙市场又该做些什么呢？#老年人##预防老年人摔跤##银发经济##烘焙##面包##老龄化#O老年人是烘焙市场值得争取的消费对象吗？,,,,"老年人,预防老年人摔跤,银发经济,烘焙,面包,老龄化",1,1,2,2021-05-27 13:43,微博 weibo.com,,,,,普通用户
4641418239542700,KhntBE2uw,5030938069,大众健康世界,【#如何预防老年人跌倒#？】65岁及以上老年人因为受伤到医疗机构就诊，很多都是跌倒受伤所致，其中创伤性骨折是最主要的就诊原因。而发生过跌倒的老年人，比没有发生过跌倒的老年人跌倒风险更高。#老年人跌倒有哪些高危因素#？怎样才能有效#预防老年人摔跤#？L央视频的微博视频,,,,"如何预防老年人跌倒,老年人跌倒有哪些高危因素,预防老年人摔跤",426,172,982,2021-05-27 10:50,微博视频号,,"http://f.video.weibocdn.com/WGRPmoZLlx07MSu9DwXe01041200Gpmx0E010.mp4?label=mp4_720p&template=864x486.25.0&trans_finger=775cb0ab963a74099cf9f840cd1987f1&ori=0&ps=1BVp4ysnknHVZu&Expires=1727193164&ssig=1quCgVBN61&KID=unistore,video",,,黄V
4641403488175619,Khn5OyiQP,2205295854,成都应急,#令人心动的offer第三季是医生#【#如何预防老年人跌倒#？】65岁及以上老年人因为受伤到医疗机构就诊，很多都是跌倒受伤所致，其中创伤性骨折是最主要的就诊原因。而发生过跌倒的老年人，比没有发生过跌倒的老年人跌倒风险更高。#老年人跌倒有哪些高危因素#？怎样才能有效#预防老年人摔跤#？戳↓@国家应急广播L央视频的微博视频,,,国家应急广播,"令人心动的offer第三季是医生,如何预防老年人跌倒,老年人跌倒有哪些高危因素,预防老年人摔跤",3,0,3,2021-05-27 09:51,微博视频号,,"http://f.video.weibocdn.com/WGRPmoZLlx07MSu9DwXe01041200Gpmx0E010.mp4?label=mp4_720p&template=864x486.25.0&trans_finger=775cb0ab963a74099cf9f840cd1987f1&ori=0&ps=1BVp4ysnknHVZu&Expires=1727193164&ssig=1quCgVBN61&KID=unistore,video",,,
4641410673017262,KhnhpcEVw,3242817930,成华应急,#令人心动的offer第三季是医生#【#如何预防老年人跌倒#？】65岁及以上老年人因为受伤到医疗机构就诊，很多都是跌倒受伤所致，其中创伤性骨折是最主要的就诊原因。而发生过跌倒的老年人，比没有发生过跌倒的老年人跌倒风险更高。#老年人跌倒有哪些高危因素#？怎样才能有效#预防老年人摔跤#？,,,,"令人心动的offer第三季是医生,如何预防老年人跌倒,老年人跌倒有哪些高危因素,预防老年人摔跤",0,0,3,2021-05-27 10:19,360安全浏览器,,,4641403488175619,,蓝V
4641404700331426,Khn7M1odA,1972589043,彭州发布,#令人心动的offer第三季是医生#【#如何预防老年人跌倒#？】65岁及以上老年人因为受伤到医疗机构就诊，很多都是跌倒受伤所致，其中创伤性骨折是最主要的就诊原因。而发生过跌倒的老年人，比没有发生过跌倒的老年人跌倒风险更高。#老年人跌倒有哪些高危因素#？怎样才能有效#预防老年人摔跤#？戳↓@国家应急广播L央视频的微博视频,,,国家应急广播,"令人心动的offer第三季是医生,如何预防老年人跌倒,老年人跌倒有哪些高危因素,预防老年人摔跤",1,0,0,2021-05-27 09:56,微博视频号,,"http://f.video.weibocdn.com/WGRPmoZLlx07MSu9DwXe01041200Gpmx0E010.mp4?label=mp4_720p&template=864x486.25.0&trans_finger=775cb0ab963a74099cf9f840cd1987f1&ori=0&ps=1BVp4ysnknHVZu&Expires=1727193164&ssig=1quCgVBN61&KID=unistore,video",,,蓝V
4641167079116417,KhgWvCfAZ,7541384596,瀛寰国际医药01,#预防老年人摔跤##如何预防老年人跌倒#日本卫材公司原研药Actonel#利塞膦酸钠#片，抑制破骨细胞的骨吸收，增强骨密度和骨强度，使其不易骨折。选购微信搜索小程序#瀛寰国际#发布了头条文章：《如何预防人生最后一次“骨折”每周一片卫材制药利塞膦酸钠片Actonel》O如何预防人生最后一次“骨折”每周一片卫材制药Actonel,,,,"预防老年人摔跤,如何预防老年人跌倒,利塞膦酸钠,瀛寰国际",0,0,1,2021-05-26 18:12,微博 weibo.com,,,,,普通用户
4641159408523062,KhgK8zLeK,2231361942,银川检察,【如何#预防老年人摔跤#】2021年5月22日，中国工程院院士袁隆平逝世，享年91岁。据多家媒体报道，今年3月份袁老的一次意外跌倒，很可能严重影响了他的健康。65岁及以上老年人因为受伤到医疗机构就诊，很多都是跌倒受伤所致，其中创伤性骨折是最主要的就诊原因。而发生过跌倒的老年人，比没有发生过跌倒的老年人跌倒风险更高。#老年人跌倒有哪些高危因素#？怎样才能有效预防老年人摔跤？戳↓#给您提个醒#via.央视频@法治日报L央视频的微博视频,,,法治日报,"预防老年人摔跤,老年人跌倒有哪些高危因素,给您提个醒",0,0,0,2021-05-26 17:41,微博视频号,,"http://f.video.weibocdn.com/WGRPmoZLlx07MSu9DwXe01041200Gpmx0E010.mp4?label=mp4_720p&template=864x486.25.0&trans_finger=775cb0ab963a74099cf9f840cd1987f1&ori=0&ps=1BVp4ysnknHVZu&Expires=1727193168&ssig=Ml74%2BqGyfI&KID=unistore,video",,,蓝V
