id,bid,user_id,用户昵称,微博正文,头条文章url,发布位置,艾特用户,话题,转发数,评论数,点赞数,发布时间,发布工具,微博图片url,微博视频url,retweet_id,ip,user_authentication
4855720329609653,MnnxuEjUp,6391230607,医路向前巍子,#疫情时期重点人群防护指南##转阴后康复期需要注意什么##老年人感染新冠后小心肺炎##新冠肺炎老小孩患者##关爱老人##健康传播抗议行为#L医路向前巍子的微博视频,,,,"疫情时期重点人群防护指南,转阴后康复期需要注意什么,老年人感染新冠后小心肺炎,新冠肺炎老小孩患者,关爱老人,健康传播抗议行为",12,17,137,2023-01-08 19:30,微博视频号,,"http://f.video.weibocdn.com/o0/7hS00JhElx082c2IsyC401041203Dj1j0E020.mp4?label=mp4_720p&template=720x1280.24.0&ori=0&ps=1BVp4ysnknHVZu&Expires=1724998769&ssig=BLENAPxg88&KID=unistore,video",,,红V
4854947403533488,Mn3qQePdK,5297298155,上海助医官方平台,#新冠感染##老人出现哪些症状要警惕肺炎##老年人感染新冠后小心肺炎##重症白肺死亡率40%以上#老人阳了以后，怀疑严重肺炎怎么办？L上海助医官方平台的微博视频,,,,"新冠感染,老人出现哪些症状要警惕肺炎,老年人感染新冠后小心肺炎,重症白肺死亡率40%以上",0,0,0,2023-01-06 16:18,微博视频号,,"http://f.video.weibocdn.com/o0/6kJYkKrolx0828JNFdy8010412014ouv0E010.mp4?label=mp4_720p&template=720x1052.24.0&ori=0&ps=1BVp4ysnknHVZu&Expires=1724998769&ssig=laTQIAIsza&KID=unistore,video",,,蓝V
4854591012737161,MmUa1bu3L,5297298155,上海助医官方平台,#肺炎##老年人感染新冠后小心肺炎##一直咳嗽会引发肺炎吗#抗原转阴后还一直咳嗽，是肺炎的征兆吗？L上海助医官方平台的微博视频,,,,"肺炎,老年人感染新冠后小心肺炎,一直咳嗽会引发肺炎吗",0,0,2,2023-01-05 16:42,微博视频号,,"http://f.video.weibocdn.com/o0/9YI6hpWglx0827ay1ZuE010412009NVg0E010.mp4?label=mp4_720p&template=720x840.24.0&ori=0&ps=1BVp4ysnknHVZu&Expires=1724998769&ssig=6JPFQqYCEE&KID=unistore,video",,,蓝V
4854532561175087,MmSDK4VH1,1428653811,逆时针走走就顺了,家里有老人的话，转阴后最好拍个胸部CT，我妈拍了有肺部感染，还好发现早开始打吊针。#男子阳后嗜睡一检查已是白肺##老年人感染新冠后小心肺炎#,,,,"男子阳后嗜睡一检查已是白肺,老年人感染新冠后小心肺炎",0,35,21,2023-01-05 12:50,iPhone 14 Pro,https://wx4.sinaimg.cn/large/552786f3ly1h9snredjvlj20om0wtgrm.jpg,,,,黄V
4852337954262104,MlXy3hSLC,1009515492,闫大夫聊肝病,#怎么判断自己肺部感染#曾光是我念大学时公卫专业本科生耳熟能详的大腕。当年报考流行病学相关专业研究生的同学们，都得去念他编的大部头教科书。不过，他又不是临床医生，所以他说夹手指头测血氧可以判断有没有肺炎，这个好像不太对。我前面已经多次说过，血氧饱和度低于93%，可能是重型肺炎。但还有普通型的肺炎也得早诊断早治疗。我认为，持续发热超过五天，而且有糖尿病、肥胖、慢性心肺基础病的老年人，都应该警惕肺炎。这类人应该做胸CT，明确有没有肺炎。#老人血氧饱和度低于多少需警惕##老年人感染新冠后小心肺炎#,,,,"怎么判断自己肺部感染,老人血氧饱和度低于多少需警惕,老年人感染新冠后小心肺炎",6,4,14,2022-12-30 11:29,HW小伙伴HarmonyOS设备,,,,,红V
4852308082951266,MlWLScnL4,5297298155,上海助医官方平台,#老年人感染新冠后小心肺炎##老年人感染初期可能只是低烧##老人出现哪些症状要警惕肺炎#很多老年人在感染新冠病毒后，第一周的症状可能只是低烧，不像年轻人那样高烧，等到不发烧了以为没事可以活动的了，发现已经出现了肺炎L上海助医官方平台的微博视频,,,,"老年人感染新冠后小心肺炎,老年人感染初期可能只是低烧,老人出现哪些症状要警惕肺炎",0,0,2,2022-12-30 09:31,微博视频号,,"http://f.video.weibocdn.com/o0/BuYMxeVulx081VYW23Vu010412007rhO0E010.mp4?label=mp4_720p&template=720x1052.24.0&ori=0&ps=1BVp4ysnknHVZu&Expires=1724998769&ssig=mhR5B3uSRc&KID=unistore,video",,,蓝V
4852272703998702,MlVQOgMfc,1866739325,忆果缘M19,如果出现以下五个症状，提示可能出现了肺部感染！及时就医！1.发烧或体温过低:发烧是传染病最常见的症状。但有些重症肺炎或老年人肺炎往往表现为低体温而不是发热，要特别注意。2.咳嗽和咳痰:这是肺炎最常见的症状之一。3.胸痛:发热、咳嗽、咳痰，并伴有胸痛症状，说明可能有肺部感染。4.呼吸困难:常见肺部原因，也有心源性和其他原因。像胸痛一样，呼吸困难也表明肺部感染和肺炎。5.咯血:多由支气管和肺血管破裂出血引起，可能是支气管和肺损伤的一种表现。#忆果缘1971##老年人感染新冠后小心肺炎##新冠感染后如何避免肺部感染#,,,,"忆果缘1971,老年人感染新冠后小心肺炎,新冠感染后如何避免肺部感染",17,5,48,2022-12-30 07:10,,https://wx3.sinaimg.cn/large/6f442e7dly1h9lgxnjzi1j20qo0ms77l.jpg,,,,金V
4852236192580232,MlUTVaPeE,1896547983,医欣_刘宝利,膜性肾病超话#深深怀念母亲#如何从中医角度看待本次奥美克戎导致老年人的感染，大家更认为本次奥美克戌的感染初发是应用麻黄汤和葛根汤的指证，这个固然没有错，因为大多数的病人都首先表现了高热，头痛，身疼痛，腰痛，骨节疼痛，无汗，恶风等麻黄汤八证中至少七证，当然用麻黄汤和葛根汤是完全正确的。一剂两剂可能烧退了，也就完全恢复了，但对于老年人，这个病变过程完全不是这么简单的，但正像西医专家所说的，老年人尤其70岁以上的，大多表现了肺炎，而且开始发病常常是低热，其实很多老年人甚至没有发热，是不是老年人的病变都轻了呢？#老年人感染初期可能只是低烧#还真的不是。伤寒论第7条病有发热无汗者，发于阳也，无热无寒者，发于阴也。😊这个无热，其实也可能就是低热，在东汉那个年代没有体温计，所以可能37度5以下都是低热，因为这个体温可能没有什么症状。301条又提到少阴病始得之，反发热脉沉者，麻黄附子细辛汤主之。这一条又得告诉我们，少阴病的发热可能没有症状，也可能有一点发热症状。。这些症状反复思考起来，和现在老年人感染奥米克戎后出现肺炎前期的症状非常非常相似。。。本次老年人的感染就像前面提到的初期几乎没怎么发热，甚至温度很低，四五天反而出现了肺炎的明显表现。。。所以针对本次奥米克戎感染发病的老年人，不管他是否有明显发热症状，都应该考虑到应该早期应用麻黄附子细辛汤，也就是说针对本次奥米克戎感染的病人，尤其老年病人，尤其是有较多基础病的（也能从侧面来提示这些基础病以阴证为主），早期不管是否有发热或者还是低热，麻黄附子细辛汤有强烈的应用指征的。。。早期应用也许是可以截断进入肺炎的。😊😊😊母亲的临床表现就是这样演变的，初期的体温一直没有超过37度5，反而最后成了病毒性肺炎。。#老年人感染新冠后小心肺炎#L医欣_刘宝利的微博视频,,北京·美术馆后街,,"深深怀念母亲,老年人感染初期可能只是低烧,老年人感染新冠后小心肺炎",20,8,40,2022-12-30 04:45,微博视频号,,"http://f.video.weibocdn.com/o0/QWV2ixSPlx081WNnDOys0104120085Mt0E010.mp4?label=mp4_720p&template=590x1280.24.0&ori=0&ps=1BVp4ysnknHVZu&Expires=1724998769&ssig=aTsabp4QRq&KID=unistore,video",,,黄V
4852111953114861,MlRFxd4jH,2429498622,优酷热榜,#老人感染新冠不要忽视胸闷气短症状##老年人感染新冠后小心肺炎##老人出现哪些症状要警惕肺炎##家有老人面对新冠要知道的事##新冠防疫手册#面对新冠病毒感染，老年人作为特殊群体，感染后应如何应对？出现哪些症状需及时就医？2022年12月29日，上海交通大学医学院附属仁济医院呼吸科副主任医师查琼芳，与市民互动交流、答疑解惑。O网页链接,,,,"老人感染新冠不要忽视胸闷气短症状,老年人感染新冠后小心肺炎,老人出现哪些症状要警惕肺炎,家有老人面对新冠要知道的事,新冠防疫手册",0,0,0,2022-12-29 20:31,iPhone客户端,https://wx2.sinaimg.cn/large/90cf34fely1h9kygivfw8j20u01n2ag7.jpg,,,,蓝V
4852109331932978,MlRBj86R4,1899550753,回忆小佳佳的黑白键,一周后复阳，直接肺炎#老年人感染新冠后小心肺炎##76岁老人感染新冠一周后去世##老人感染新冠不要忽视胸闷气短症状##老人出现哪些症状要警惕肺炎#,,,,"老年人感染新冠后小心肺炎,76岁老人感染新冠一周后去世,老人感染新冠不要忽视胸闷气短症状,老人出现哪些症状要警惕肺炎",0,0,0,2022-12-29 20:21,小米11 Pro,https://wx2.sinaimg.cn/large/7138d821gy1h9ky4uzuc3j20u01uo436.jpg,,,,普通用户
4852058605231369,MlQhulWUV,5544822167,高尚PET王5亿,今日我们高尚影像中心新冠肺炎筛查病人是108例，其中28例有轻度新冠肺炎影像表现，检出率接近26%，最最小14岁（下面第一排CT图像），最大年龄是87岁（下面第二排CT图像），大部分人的年龄超过60例。由此可以看出，新冠病毒肺炎可能会累及各个年龄段，但主要还是60岁以上老年人群。如果新冠感染超过2周咳嗽症状还不减轻者，最好做一个胸部CT判断有无新冠病毒肺炎，这对于决策治疗方案及预测治疗效果都很关键。#老年人感染新冠后小心肺炎##感染新冠都要做CT吗#,,,,"老年人感染新冠后小心肺炎,感染新冠都要做CT吗",2,15,28,2022-12-29 16:59,HUAWEI Mate 30 5G,"https://wx3.sinaimg.cn/large/0063fvxBly1h9kscbu0cdj31vv1g04qp.jpg,https://wx1.sinaimg.cn/large/0063fvxBly1h9ksccj21wj31yd1fc7wh.jpg,https://wx1.sinaimg.cn/large/0063fvxBly1h9kscd1nc1j31vu1dnquq.jpg,https://wx3.sinaimg.cn/large/0063fvxBly1h9kscdpzxjj31xf1ff4qp.jpg,https://wx4.sinaimg.cn/large/0063fvxBly1h9ksceovkfj32401g2e81.jpg,https://wx1.sinaimg.cn/large/0063fvxBly1h9kscg7zqxj32401jyx6p.jpg",,,,黄V
4851953479990048,MlNxVFURO,7791814698,丢了一个微博号的人,#关注新冠肺炎##新冠肺炎为何更名新型冠状病毒感染#新冠感染##老年人感染新冠后小心肺炎#简单的说这一波感染上的人全部都是穷人。还有工作敬业的人！不接受反驳。我希望如果还有后续，希望我们这些平民们不要再遭受，希望那些专家以及倡导开放的人全部来一波。,,,,"关注新冠肺炎,新冠肺炎为何更名新型冠状病毒感染",0,0,0,2022-12-29 10:01,iPhone客户端,,,,,普通用户
4851932542273333,MlN0a9xoF,1866739325,忆果缘M19,老人感染要密切关注4个指标家人一定要密切监测老人的体温、心率、脉搏以及外周血氧饱和度的变化。如果这几项指标都比较稳定，就没有关系；如果出现不稳定，特别是血氧饱和度明显下降，就要及时送医。就诊越早，救治成功率越高。体温老年人对机体异常的反应不像年轻人那样明显，“阳了”不一定会发热。很多老年人基础体温偏低，发烧的程度往往不高，体温上升1℃就可能很难受了。当家里的老人体温不超过38℃时，可优先考虑物理降温，比如温水擦浴。当老年人体温超过38.5℃，口服退烧药后超过半小时未见明显控制的，最好及时就医。血氧饱和度北京老年医院呼吸内科副主任田蓉表示，对老人来说，血氧是比体温更重要的一个指标，可反映动脉血液的含氧量，是判断呼吸循环是否正常的重要指标。正常情况下，血氧饱和度应在95%以上，年轻人会接近100%，患有基础性疾病的老年人可能略低；如果动脉血氧饱和度低于90%，则为低氧血症，这不仅是常见的危重病，也是呼吸衰竭的重要表现，需要及时吸氧治疗。家里可以准备一个指夹式血氧仪（俗称“氧饱夹”），有助及时识别危险的低氧血症：如果血氧饱和度小于90%，需尽快到医院就诊；对一些患有严重慢性疾病、尤其是肺部疾病的患者来说，血氧饱和度可能本就较低，如果出现突然明显下降，下降幅度超5%及以上，也应高度警惕，尽快就医。如果买不到血氧仪，可以密切关注老人的呼吸状态、活动耐力等来识别“沉默性缺氧”的发生，具体方法：成人正常呼吸频率为12~20次/分，当发生重症时，呼吸频率可超过30次/分，应及时就医。当出现呼吸频率明显变快，喘气费力，说话断断续续，嘴唇发紫，轻度体力工作、平地步行100米或上2层楼就会大量出汗或气短，要警惕起来，尽快就医。心率或脉搏发烧时，心率或脉搏一般会有所增快。如果发现老人的心率比平时变化明显，说明心血管系统可能有所改变，要及时就诊处理。精神状态复旦大学附属中山医院重症医学科主任钟鸣提醒，老年人机体反应弱，但还是有一些指标有助判断病情，比如神志。神志清醒对身体各个系统的要求很高，当看到老年人神志萎靡、淡漠、不想吃喝，就要高度警惕了。#忆果缘1971##老年人感染新冠后小心肺炎#,,,,"忆果缘1971,老年人感染新冠后小心肺炎",11,1,7,2022-12-29 08:38,,https://wx3.sinaimg.cn/large/6f442e7dly1h9kdv88g4pj20sg0j0wh1.jpg,,,,金V
4851930528750951,MlMWUAIwn,1866739325,忆果缘M19,“阳康”后就万事大吉了吗？什么情况提示需要就医检查？在门诊确实接诊了一些病人，就诊时新冠抗原或核酸已经转阴了，但咳嗽、胸闷等症状仍不改善，经胸部CT检查发现新冠病毒感染后发生了新冠肺炎。这种情况不仅出现在老年人身上，也发生在一些年轻患者身上。因此，“阳康”后也要重视久咳不愈的情况，如果咳嗽症状长期不见缓解，并影响睡眠作息，就应该及时到医院进行相应检查，以防小病变大病。同时，还有一些患者“阳康”后还有持续低烧的情况，也应到医院就诊行胸部CT、血常规等检查，看看是否存在新冠肺炎或合并其他肺部感染性疾病。#老年人感染新冠后小心肺炎##忆果缘1971##全民来说抗疫经验#,,,,"老年人感染新冠后小心肺炎,忆果缘1971,全民来说抗疫经验",0,0,1,2022-12-29 08:30,,https://wx4.sinaimg.cn/large/6f442e7dly1h9kdmwnvovj20go0b4gly.jpg,,,,金V
4851929370857208,MlMV33AZW,1866739325,忆果缘M19,老年人在居家过程中的健康监测重点是什么？什么情况需要就医？老年人脏器功能、免疫力较年轻人都较低，往往都伴有一种或多种基础病。有些老年人由于长期居家，还存在疫苗接种不全的情况。因此，老年人是发生重症的高风险人群，是健康监测的重点对象。居家过程中，如果出现呼吸困难、气促等情况，有可能是新冠病毒感染引起的重症肺炎的表现。这时需要及时就诊。感染新冠的高热病人，一般3天内体温可降至正常，若居家3天经对症治疗体温仍大于38.5摄氏度，就需要及时就诊。有基础病的患者出现了基础疾病急性加重的临床表现，也需要及时就诊。另外，对于老年人来说，还要关注他的神志和饮食方面的变化，如出现障碍，照护者一定要特别关注，并及时送医。#老年人感染新冠后小心肺炎##居家健康监测需关注哪些指标##忆果缘1971#,,,,"老年人感染新冠后小心肺炎,居家健康监测需关注哪些指标,忆果缘1971",0,1,0,2022-12-29 08:26,,https://wx3.sinaimg.cn/large/6f442e7dly1h9kdi4isdrj20xq0mhn9p.jpg,,,,金V
4851928649178022,MlMTSCvCC,1866739325,忆果缘M19,为什么老年人容易出现症状不明显而病情严重的情况，容易出现“沉默性低氧”？缺氧常见的临床表现一般为胸闷、呼吸困难、呼吸急促，可以看到甲床、口唇紫绀等表现。老年人出现缺氧有时反应不那么明显的原因，一方面是由于老年人反应较年轻人迟钝，对缺氧的表现没有那么敏感。另一方面，病情较重时可能会导致老年人出现神志、认知方面的障碍，影响他向家属描述病情，导致照护者对老人缺氧的情况疏于发现。因此，在居家照护时，一定对于老人，特别是高龄老人、失能失智老人的健康状况要特别关注。#警惕老人沉默性缺氧##老年新冠患者需警惕沉默性缺氧##忆果缘1971##老年人感染新冠后小心肺炎#,,,,"警惕老人沉默性缺氧,老年新冠患者需警惕沉默性缺氧,忆果缘1971,老年人感染新冠后小心肺炎",0,0,1,2022-12-29 08:23,,https://wx1.sinaimg.cn/large/6f442e7dly1h9kdf59rcoj20dw09gwjg.jpg,,,,金V
4851379552393287,MlyCfa2Bp,6524412392,忙碌荔枝干,【别拖！#老年人感染新冠后小心肺炎#】老年人感染新冠后不要拖，如果出现以下情况一定要及时就医。详细戳视频！L小莉帮忙的微博视频,,,,老年人感染新冠后小心肺炎,0,0,0,2022-12-27 20:01,微博视频号,,"http://f.video.weibocdn.com/o0/fnI4xQPdlx081SJRmCdG010412008OVF0E010.mp4?label=mp4_720p&template=720x1280.24.0&ori=0&ps=1BVp4ysnknHVZu&Expires=1724998771&ssig=aGO0yQLNUN&KID=unistore,video",,,普通用户
4851379548725963,MlyCeAC1l,6574339903,青春没那么伤,【别拖！#老年人感染新冠后小心肺炎#】老年人感染新冠后不要拖，如果出现以下情况一定要及时就医。详细戳视频！L小莉帮忙的微博视频,,,,老年人感染新冠后小心肺炎,0,0,1,2022-12-27 20:01,微博视频号,,"http://f.video.weibocdn.com/o0/fnI4xQPdlx081SJRmCdG010412008OVF0E010.mp4?label=mp4_720p&template=720x1280.24.0&ori=0&ps=1BVp4ysnknHVZu&Expires=1724998771&ssig=aGO0yQLNUN&KID=unistore,video",,,黄V
4851379548456117,MlyCeztOZ,6573835750,我们去有风的地方,【别拖！#老年人感染新冠后小心肺炎#】老年人感染新冠后不要拖，如果出现以下情况一定要及时就医。详细戳视频！L小莉帮忙的微博视频,,,,老年人感染新冠后小心肺炎,0,0,0,2022-12-27 20:01,微博视频号,,"http://f.video.weibocdn.com/o0/fnI4xQPdlx081SJRmCdG010412008OVF0E010.mp4?label=mp4_720p&template=720x1280.24.0&ori=0&ps=1BVp4ysnknHVZu&Expires=1724998771&ssig=aGO0yQLNUN&KID=unistore,video",,,黄V
4851379548199861,MlyCeyp9P,6573835617,被冷风吹的发抖抖,【别拖！#老年人感染新冠后小心肺炎#】老年人感染新冠后不要拖，如果出现以下情况一定要及时就医。详细戳视频！L小莉帮忙的微博视频,,,,老年人感染新冠后小心肺炎,0,0,1,2022-12-27 20:01,微博视频号,,"http://f.video.weibocdn.com/o0/fnI4xQPdlx081SJRmCdG010412008OVF0E010.mp4?label=mp4_720p&template=720x1280.24.0&ori=0&ps=1BVp4ysnknHVZu&Expires=1724998772&ssig=ydHnOh%2BMEP&KID=unistore,video",,,普通用户
4851379544536125,MlyCej23j,6573837753,老鼠的儿子不会打洞,【别拖！#老年人感染新冠后小心肺炎#】老年人感染新冠后不要拖，如果出现以下情况一定要及时就医。详细戳视频！L小莉帮忙的微博视频,,,,老年人感染新冠后小心肺炎,0,0,0,2022-12-27 20:01,微博视频号,,"http://f.video.weibocdn.com/o0/fnI4xQPdlx081SJRmCdG010412008OVF0E010.mp4?label=mp4_720p&template=720x1280.24.0&ori=0&ps=1BVp4ysnknHVZu&Expires=1724998772&ssig=ydHnOh%2BMEP&KID=unistore,video",,,普通用户
4851379544009898,MlyCegP9M,6573835774,我们的初恋未满,【别拖！#老年人感染新冠后小心肺炎#】老年人感染新冠后不要拖，如果出现以下情况一定要及时就医。详细戳视频！L小莉帮忙的微博视频,,,,老年人感染新冠后小心肺炎,0,0,0,2022-12-27 20:01,微博视频号,,"http://f.video.weibocdn.com/o0/fnI4xQPdlx081SJRmCdG010412008OVF0E010.mp4?label=mp4_720p&template=720x1280.24.0&ori=0&ps=1BVp4ysnknHVZu&Expires=1724998772&ssig=ydHnOh%2BMEP&KID=unistore,video",,,普通用户
4851379543478314,MlyCeeARQ,6573835873,暗恋在心中下大雨,【别拖！#老年人感染新冠后小心肺炎#】老年人感染新冠后不要拖，如果出现以下情况一定要及时就医。详细戳视频！L小莉帮忙的微博视频,,,,老年人感染新冠后小心肺炎,0,0,0,2022-12-27 20:01,微博视频号,,"http://f.video.weibocdn.com/o0/fnI4xQPdlx081SJRmCdG010412008OVF0E010.mp4?label=mp4_720p&template=720x1280.24.0&ori=0&ps=1BVp4ysnknHVZu&Expires=1724998772&ssig=ydHnOh%2BMEP&KID=unistore,video",,,黄V
4851379535875429,MlyCdoEsZ,1852852983,主持人笑歌,【别拖！#老年人感染新冠后小心肺炎#】老年人感染新冠后不要拖，如果出现以下情况一定要及时就医。详细戳视频！L小莉帮忙的微博视频,,,,老年人感染新冠后小心肺炎,0,0,0,2022-12-27 20:01,微博视频号,,"http://f.video.weibocdn.com/o0/fnI4xQPdlx081SJRmCdG010412008OVF0E010.mp4?label=mp4_720p&template=720x1280.24.0&ori=0&ps=1BVp4ysnknHVZu&Expires=1724998772&ssig=ydHnOh%2BMEP&KID=unistore,video",,,黄V
4851379531417271,MlyCd5WHd,1561207815,行云流水_小刘来了,【别拖！#老年人感染新冠后小心肺炎#】老年人感染新冠后不要拖，如果出现以下情况一定要及时就医。详细戳视频！L小莉帮忙的微博视频,,,,老年人感染新冠后小心肺炎,0,0,0,2022-12-27 20:01,微博视频号,,"http://f.video.weibocdn.com/o0/fnI4xQPdlx081SJRmCdG010412008OVF0E010.mp4?label=mp4_720p&template=720x1280.24.0&ori=0&ps=1BVp4ysnknHVZu&Expires=1724998772&ssig=ydHnOh%2BMEP&KID=unistore,video",,,黄V
4851379526443133,MlyCcr29v,1634660355,小莉帮忙陈小莉,【别拖！#老年人感染新冠后小心肺炎#】老年人感染新冠后不要拖，如果出现以下情况一定要及时就医。详细戳视频！L小莉帮忙的微博视频,,,,老年人感染新冠后小心肺炎,0,0,0,2022-12-27 20:01,微博视频号,,"http://f.video.weibocdn.com/o0/fnI4xQPdlx081SJRmCdG010412008OVF0E010.mp4?label=mp4_720p&template=720x1280.24.0&ori=0&ps=1BVp4ysnknHVZu&Expires=1724998772&ssig=ydHnOh%2BMEP&KID=unistore,video",,,黄V
