id,bid,user_id,用户昵称,微博正文,头条文章url,发布位置,艾特用户,话题,转发数,评论数,点赞数,发布时间,发布工具,微博图片url,微博视频url,retweet_id,ip,user_authentication
5015529661926393,O6vZQ858R,2157242792,上海流浪天使救助行动,在没有动保立法的国度，它们成了玩物遗弃，商品制造和繁殖机器和野蛮贪欲者口中的一块🥩。中国的猫狗竟然没有保护与管理的立法，最终人与动物都是是受害者#虐待动物入刑##老人被狗绳绊倒摔地后身亡##男子被流浪猫绊倒投喂者赔24万#L上海流浪天使救助行动的微博视频,,,,"虐待动物 入刑,老人被狗绳绊倒摔地后身亡,男子被流浪猫绊倒投喂者赔24万",3,0,13,2024-03-24 19:15,微博视频号,,"http://f.video.weibocdn.com/o0/biohqG3Flx08dxwm4MXC01041200b5mR0E010.mp4?label=mp4_720p&template=720x1600.24.0&ori=0&ps=1BVp4ysnknHVZu&Expires=1726070709&ssig=aApTLLa%2Bcw&KID=unistore,video",,上海,普通用户
5015398867537511,O6sASvCQL,2157242792,上海流浪天使救助行动,因为国家动保立法迟迟不出台才会导致关于流浪猫狗的事发管理无序概念混乱。#呼吁动保立法#饲养行为认定的构成要素需要有：稳定的食物来源、相对固定的场所、相对固定的动物，且应当具有持续性。换言之，偶然发生的、不固定的、投喂不特定动物的行为，不应被认定为饲养行为。#呼吁人道对待动物呼吁中国动保立法##男子被流浪猫绊倒投喂者赔24万##老人被狗绳绊倒摔地后身亡#『被猫绊倒索赔24万引争议，“投喂”竟成了原罪？』https://mp.weixin.qq.com/s?__biz=MjM5MjY0MjgxNA==&mid=2651374943&idx=1&sn=e6c8d312b67e0eb8acc14586c0ca5718&chksm=bcd28cbe116648801e9ef76d1bdcb3d01e2f22a81c1da9ce0e6ae8fc1bb1f936ee80635e39b9&xtrack=1&from=groupmessage&scene=1&subscene=10000&clicktime=1711247376&enterid=1711247376&sessionid=0&ascene=1&fasttmpl_type=0&fasttmpl_fullversion=7129723-zh_CN-zip&fasttmpl_flag=0&realreporttime=1711247377007&devicetype=android-31&version=28002656&nettype=WIFI&abtest_cookie=AAACAA%3D%3D&lang=zh_CN&countrycode=CN&exportkey=n_ChQIAhIQe6pPx8c6bbm8gNjrAc11WhLwAQIE97dBBAEAAAAAAHH2CzQNhwUAAAAOpnltbLcz9gKNyK89dVj04JMmopPUqLOcwEm5prz7WDtVLJ6S%2FgSWztYtvbSSw26F9NFStyVJ39HguVZZi%2Fhh0%2BRGTq1tG8CZF2UNiG9FGjkcxPP%2B9wZ%2FQpdEq3CjQSZIePFJduKUEv2cUKPQN1Aaw5JUVhbWA18V0S6geznlS495cgbMdp%2BsdRTwdg5yHqydPdvfJQbTPFX21UEoPdQsxaHC7hQN7Wx9X0zy4v5%2FifZfh%2B%2B%2Fs%2BOuWKizTtyc54ZRYJfwas2%2FnAw6gkw5%2FrxuVk5uC7UbIFgvSQ%3D%3D&pass_ticket=Q5hfZPyqZAGVqdVKHZnLPUCbUECRo9fIs7O%2FgHJTVwWiDqtl2i813V%2F81Z0YX%2Bvv1WL%2FVFlx0V1opSUpjwBuIw%3D%3D&wx_header=3,,,,"呼吁动保立法,呼吁人道对待动物 呼吁中国动保立法,男子被流浪猫绊倒投喂者赔24万,老人被狗绳绊倒摔地后身亡",5,0,12,2024-03-24 10:35,OPPO Reno4 Pro 5G,,,,上海,普通用户
4532470353497517,JdCHxeFRz,3203922320,快把我哥带走,#快把我哥带走#222话：反转的万幸……#我在微博看漫画#快把我哥带走超话,,,,"快把我哥带走,我在微博看漫画",400,208,3243,2020-07-30 19:30,微博 weibo.com,https://wx2.sinaimg.cn/large/bef7f990ly1gh94kl9whsj20m8bmgu0y.jpg,,,,
4959420644854364,NoVNKkmQc,2657710052,酋长球场的正机之神,复习一下正确的宠保方案。宠保小将只骂人不出钱啥用没有，只会让无主宠物泛滥成灾。#警方通报女童被狗咬伤##四川被狗咬伤女童家属已筹得200万元##老人被狗绳绊倒摔地后身亡##女主持未拴狗绳遭暴打#,,,,"警方通报女童被狗咬伤,四川被狗咬伤女童家属已筹得200万元,老人被狗绳绊倒摔地后身亡,女主持未拴狗绳遭暴打",0,0,3243,2023-10-21 23:18,HUAWEI Mate 30 5G,,,4532470353497517,江苏,普通用户
4958250453960929,NormlgCpX,1828506115,逸北殊伦,#咬伤女童黑狗的主人被刑拘#能问问#老人被狗绳绊倒摔地后身亡#的事后续咋样了,,,,"咬伤女童黑狗的主人被刑拘,老人被狗绳绊倒摔地后身亡",0,1,0,2023-10-18 17:48,,,,,浙江,普通用户
4927016958427980,NbkPJzmva,5249119946,言灵潇,8.9-10.7这段时间会有很多人买周大福梵克雅宝等首饰，特别是9.8号以后辛酉月一堆人买珠宝，不过因为紧年癸水泄金，今年的金子也不会价格太虚高，丁火丙火戊土己土可以买。8字原局就金旺的人还有辛金庚金日主，这两个月买金子会被销售坑，这两个月也会有一堆人去美容院做医美/整容，或者去看牙被狠狠宰一笔。星座超话#星座##好运##十二星座##肖战##王一博##蔡徐坤##杨幂##星盘##老人被狗绳绊倒摔地后身亡#,,,,"星座,好运,十二星座,肖战,王一博,蔡徐坤,杨幂,星盘,老人被狗绳绊倒摔地后身亡",5,30,40,2023-07-24 13:17,iPhone客户端,,,,江苏,黄V
4926612983778343,NbakafQV1,5249119946,言灵潇,8.8-10.7这两个月金旺，很多人会去听歌听演唱会k歌，但是身强庚金辛金日主干这类事会破财，身强壬水癸水听多了emo抑郁，甲木乙木听了恋爱脑加重被克，只有身强火日主是喜金的，最适合听音乐的，至于土日主也可以听听食伤泄秀，不利于感情事业就是了。#好运##转运#星座超话#星座##好运##十二星座##肖战##王一博##蔡徐坤##杨幂##星盘##老人被狗绳绊倒摔地后身亡#,,,,"好运,转运,星座,十二星座,肖战,王一博,蔡徐坤,杨幂,星盘,老人被狗绳绊倒摔地后身亡",4,15,28,2023-07-23 10:32,iPhone客户端,,,,江苏,黄V
4925109112931188,Naxczcixe,5249119946,言灵潇,不牵狗绳真的是一大难题，一线二线城市养狗的人很多，人也很多，不像农村那么空旷狗子到处跑也不会影响别人。小时候被表弟家的狼狗咬到了虎口，我正好属虎不过咬完打针以后一点事都没有，也没有留疤。虎=寅木，狗=戊土寅木克戊土保护我，我很喜欢猫，一般都是火日主喜欢狗，因为狗子是火日主的食伤，喜欢养鸟的是8字里有酉金的，喜欢养兔子的是有卯木。己土日主不适合养狗戊土，乙木不适合养猫寅木，壬水不适合养仓鼠，癸水不适合养猪，戊土不适合养牛，庚金不能养鸡，辛金不适合养猴，甲木不适合养兔子，丁火不适合养蛇，丙火不适合养马，之前一个己土女我劝她别养狗，结果她养了，狗是她的劫财，花了她好多好多钱每天都去医院看不好病，狗子也可怜，这几年木旺克戊土老去医院。#好运##转运#星座超话#星座##好运##十二星座##肖战##王一博##蔡徐坤##杨幂##星盘##老人被狗绳绊倒摔地后身亡#,,,,"好运,转运,星座,十二星座,肖战,王一博,蔡徐坤,杨幂,星盘,老人被狗绳绊倒摔地后身亡",1,6,15,2023-07-19 06:56,iPhone客户端,,,,江苏,黄V
