id,bid,user_id,用户昵称,微博正文,头条文章url,发布位置,艾特用户,话题,转发数,评论数,点赞数,发布时间,发布工具,微博图片url,微博视频url,retweet_id,ip,user_authentication
4811415444259866,M4MY0hSbw,2328007923,灰产圈_,发布了头条文章：《老人给多名学生下跪，替被霸凌的孙子求情》#官方通报老人当街给学生下跪##襄汾饭店过寿老人下跪道歉##老人被逼下跪道歉##老人雨天下跪被扇耳光##坍塌饭店过寿老人下跪道歉##天津志愿者回应被迫给老人下跪##官方通报老人当街向学生下跪##老人疑因孙子被打给多名学生下跪##男子持菜刀逼老人下跪被抓##警方回应天津2老人核酸插队并逼志愿者下跪##警方回应老人当街向学生下跪##老人下跪求清白##南昌回应老人车站下跪事件##广东警方通报男子持菜刀逼老人下跪##天津2老人核酸插队并逼志愿者下跪##广东男子持菜刀逼老人当街下跪##老人掌掴学生致其下跪##南京八旬老人重阳节下跪##孙子霸占奶奶房产##灰产圈#O老人给多名学生下跪，替被霸凌的孙子求情,http://t.cn/A6SYCv3o,,,"官方通报老人当街给学生下跪,襄汾饭店过寿老人下跪道歉,老人被逼下跪道歉,老人雨天下跪被扇耳光,坍塌饭店过寿老人下跪道歉,天津志愿者回应被迫给老人下跪,官方通报老人当街向学生下跪,老人疑因孙子被打给多名学生下跪,男子持菜刀逼老人下跪被抓,警方回应天津2老人核酸插队并逼志愿者下跪,警方回应老人当街向学生下跪,老人下跪求清白,南昌回应老人车站下跪事件,广东警方通报男子持菜刀逼老人下跪,天津2老人核酸插队并逼志愿者下跪,广东男子持菜刀逼老人当街下跪,老人掌掴学生致其下跪,南京八旬老人重阳节下跪,孙子霸占奶奶房产,灰产圈",0,0,0,2022-09-08 13:18,微博 weibo.com,,,,山东,黄V
4811039793222077,M4Dc7dwcZ,1181652531,夕琳看世界,一老人向多名初中生下跪，引发的人性反思。这是我们家庭教育的错，还是校园暴力的后遗症？今天讲述两个女人下跪的故事，一个让我气愤难平，一个让我感动落泪。#老人被逼下跪道歉##济源通报老人当街向学生下跪##校园暴力曝光台#人生感悟超话#人生感悟#L夕琳的人生哲学的微博视频,,北京·宣武艺园,,"老人被逼下跪道歉,济源通报老人当街向学生下跪,校园暴力曝光台,人生感悟",1,5,5,2022-09-07 12:25,微博视频号,,"http://f.video.weibocdn.com/o0/W4CgZt3flx07Z1u3f0c80104120c6NJv0E050.mp4?label=mp4_720p&template=1280x720.25.0&ori=0&ps=1BVp4ysnknHVZu&Expires=1726908345&ssig=XeMydW24YJ&KID=unistore,video",,北京,黄V
4810993353884774,M4BZdgiBE,5252848511,藏蓝观察,估计小编在颤抖吧……#老人被逼下跪道歉#,,,,老人被逼下跪道歉,1,1,0,2022-09-07 09:21,HarmonyOS设备,,,,甘肃,黄V
4810966090909472,M4Bhf3OAU,1181652531,夕琳看世界,一老人向多名初中生下跪，疑老人孙子被他们在学校及上学的路上经常恐吓殴打，不敢上学，老人求放过。于是，其中一名男生要求老人下跪。老人不顾自己的尊严，向多名初中生下跪求情。一边磕头，一边哭泣。这一幕被路人围观并引发争论，其中一路人与一个初中生产生口角，被殴打。这一大跌眼镜的事件，发生在河南省济源市，济源市是一个县级市，在河南属于贫困落后地区。此事被曝光之后，派出所已经立案，并责成教育部门进行学生安全教育。#老人被逼下跪道歉##济源通报老人当街向学生下跪##校园暴力曝光台#L夕琳的人生哲学的微博视频,,北京·城市绿心森林公园,,"老人被逼下跪道歉,济源通报老人当街向学生下跪,校园暴力曝光台",0,0,3,2022-09-07 07:32,微博视频号,,"http://f.video.weibocdn.com/o0/GtlVTnzzlx07Z19UjoQo0104120038Bc0E010.mp4?label=mp4_720p&template=720x1280.24.0&ori=0&ps=1BVp4ysnknHVZu&Expires=1726908345&ssig=hTzoyQyJ1o&KID=unistore,video",,北京,黄V
4806842217927996,M2RZPxgqU,7001561510,斯坦福御女,好过分啊，现在的社会就没有一点人情，老人都是被社会遗弃的人，他们被时代车轮抛弃，为何我们还要再踩一脚呢？通融一下不行吗，又不是什么大事#新星v计划##亿点曝光计划##老人被逼下跪道歉#L茶茶不爱1的微博视频,,,,"新星v计划,亿点曝光计划,老人被逼下跪道歉",0,0,0,2022-08-26 22:25,微博视频号,,"http://f.video.weibocdn.com/o0/TFxDV7dzlx07YJ0yrKly01041200axDC0E010.mp4?label=mp4_720p&template=720x1280.24.0&ori=0&ps=1BVp4ysnknHVZu&Expires=1726908345&ssig=s8pSjk%2BpeL&KID=unistore,video",,江苏,黄V
4703521679872373,L1tC7FqfP,5214352396,城市中的奋斗精神,"#网购出了清仓大甩卖的感觉#首先保证家用电器都是有能效标示的，不是三无产品！！电器都要保证没有漏电风险！！必须是符合国标！！我于2021年7月在国美电器购买的标称：广东美的生活电器有限公司生产的美的牌多功能电磁炉价格984元钱一台。随后使用的几天里该电磁炉发出刺鼻的化学气体让人窒息🙊🙊。该产品外包装标注信息为：执行标准GB4706.1－2005,货号DH2210。型号：C22–DH2210，唯独没有贴能效标识，疑似不合格电磁炉。⚡⚡广东美的生活电器有限公司作为生产商没有多功能电磁炉的质量报告。该销售商与生产厂家违反《能源效率标识管理办法》第五条　列入《目录》的用能产品生产者和进口商应当向国家质检总局和国家发展改革委授权的中国标准化研究院（以下简称授权机构）备案能效标识及相关信息。销售商明知该产品没有能效标识不允许对外销售，依然销售给我消费者。就应该赔偿我们消费者的损失。👏👏👏#网购##老人被骗应该怎么办##老人不会花钱影响健康##8旬老人被骗子远程刷脸转走238万##老人被逼下跪道歉##印象最深的一次被骗经历##全社会反诈进行时##反诈骗##全民反腐##反腐##二维码有毒##二维码##网购被骗##二维码诈骗##为民办实事##市民爆料##爆料##互联网爆料##中国消费者权益保护法12315#",,,,"网购出了清仓大甩卖的感觉,网购,老人被骗应该怎么办,老人不会花钱影响健康,8旬老人被骗子远程刷脸转走238万,老人被逼下跪道歉,印象最深的一次被骗经历,全社会反诈进行时,反诈骗,全民反腐,反腐,二维码有毒,二维码,网购被骗,二维码诈骗,为民办实事,市民爆料,爆料,互联网爆料,中国消费者权益保护法12315",0,0,0,2021-11-14 19:46,vivo Y3标准版,"https://wx4.sinaimg.cn/large/005GSTg0ly1gwex2kcyhaj31dk2qckjl.jpg,https://wx1.sinaimg.cn/large/005GSTg0ly1gwex2pzrlbj31c811cngh.jpg,https://wx1.sinaimg.cn/large/005GSTg0ly1gwex39y0bwj31i82rgu0x.jpg,https://wx1.sinaimg.cn/large/005GSTg0ly1gwex3gh3mzj32981fc7wh.jpg,https://wx3.sinaimg.cn/large/005GSTg0ly1gwex3p0h11j334o10k1kx.jpg,https://wx2.sinaimg.cn/large/005GSTg0ly1gwex45azukj32ws27c7wi.jpg",,,,普通用户
4332877687224023,HdNiwujiv,6569488052,莫如贝,#老人被逼下跪道歉#法法法一天到晚搞你🐴个法律，对对对受助方原则上没有义务通报他人救小女孩，这还是人说的话吗？别你🐴一天到晚拿法律当挡箭牌，法律是人定的的不是牲口定的媒体这一波带节奏报道简直恶心至极!还“迷迷糊糊”，我可去你🐴，你那么迷糊怎么不埋在水里干脆就不起来,,,,老人被逼下跪道歉,0,0,0,2019-01-27 01:00,AI实力派 vivo Z1,,,,,普通用户
4009582667259148,E41hUusr2,1934822417,Luci琭琭,“下跪的老人打人的大妈，到底怎么了？@USA美国那些事儿@美国侨报网@新浪新闻@秒拍视频#中国游客洛杉矶掌掴店员##老人被逼下跪道歉##琭琭先生请回答#”我的秒拍作品，一起来看~L琭琭先生的秒拍视频（使用#秒拍#录制）,,,"USA美国那些事儿,美国侨报网,新浪新闻,秒拍视频","中国游客洛杉矶掌掴店员,老人被逼下跪道歉,琭琭先生请回答,秒拍",5,1,8,2016-08-17 22:01,吃瓜视频,,"http://gslb.miaopai.com/stream/q-5xFhFwY2BMqB4yrtB4DA__.mp4?yx=&refer=weibo_app&vend=weibo&label=mp4_hd&mpflag=0&ori=0&ps=1BVp4ysnknHVZu&Expires=1726908345&ssig=2jR31EgcC%2B&KID=unistore,video",,,
4009583267205873,E41iSuezL,5826131259,探酸CO2,@秒拍视频#中国游客洛杉矶掌掴店员##老人被逼下跪道歉##琭琭先生请回答#,,,秒拍视频,"中国游客洛杉矶掌掴店员,老人被逼下跪道歉,琭琭先生请回答",0,0,8,2016-08-17 22:03,iPhone 6 Plus,,,4009582667259148,,普通用户
