id,bid,user_id,用户昵称,微博正文,头条文章url,发布位置,艾特用户,话题,转发数,评论数,点赞数,发布时间,发布工具,微博图片url,微博视频url,retweet_id,ip,user_authentication
5069439250993511,Ot8qN4asn,7780920254,刘婧_京仁博爱口腔,"京仁博爱口腔贺通州区马驹桥镇“积极老龄观，健康老龄化”国情教育系列活动启动会圆满成功！面对日益严峻的人口老龄化挑战，此次活动的举办意义重大，旨在提升社会对老年人健康的关注，推动健康老龄化进程。作为专业口腔医疗机构，京仁博爱口腔深知老年人口腔健康的重要性，一直秉承""以患者为中心，回归医疗本质""的服务理念。我们积极响应国家健康老龄化的号召，通过开展口腔健康讲座、口腔检查活动等方式，普及口腔健康知识，提高老年人的口腔保健意识，为他们的晚年生活增添健康保障。让我们携手社会各界，共同为老年人营造一个健康、和谐的生活环境，助力他们享有尊严和幸福的晚年。再次祝贺活动圆满成功，期待为健康老龄化事业贡献更多力量。#京仁博爱口腔##通州马驹桥##健康老龄化##口腔健康#",,,,"京仁博爱口腔,通州马驹桥,健康老龄化,口腔健康",0,0,0,2024-08-20 13:32,微博网页版,"https://wx2.sinaimg.cn/large/008uzWNMly1hsua5q9830j31hc0u04qp.jpg,https://wx2.sinaimg.cn/large/008uzWNMly1hsua5qajowj31hc0u04qp.jpg,https://wx3.sinaimg.cn/large/008uzWNMly1hsua5q8jo7j31hc0u01kx.jpg,https://wx4.sinaimg.cn/large/008uzWNMly1hsua5q6e93j31hc0u0nn7.jpg,https://wx1.sinaimg.cn/large/008uzWNMly1hsua5q5t4gj31hc0u0e4f.jpg,https://wx3.sinaimg.cn/large/008uzWNMly1hsua5q7n0zj31hc0u01kx.jpg,https://wx4.sinaimg.cn/large/008uzWNMly1hsua5q3ibwj31hc0u0tw3.jpg,https://wx4.sinaimg.cn/large/008uzWNMly1hsua5q5806j31hc0u01i3.jpg,https://wx1.sinaimg.cn/large/008uzWNMly1hsua5q9khbj31hc0u01kx.jpg",,,,黄V
5062936169022567,OqpfWBRbh,2409958151,植提桥创新咨询,发布了头条文章：《新中年，给企业又一个赚钱机会》#新中年##营养健康##营养健康产业##精准营养##心血管健康##健康老龄化#O新中年，给企业又一个赚钱机会,http://t.cn/A68pWjdG,,,"新中年,营养健康,营养健康产业,精准营养,心血管健康,健康老龄化",0,0,0,2024-08-02 14:51,微博 weibo.com,,,,,蓝V
5061894660164390,OpYa60GLs,2409958151,植提桥创新咨询,发布了头条文章：《新研究：发酵越橘提取物，面向健康老龄化市场》#健康老龄化##越橘提取物##口服美容#O新研究：发酵越橘提取物，面向健康老龄化市场,http://t.cn/A68S5CZC,,,"健康老龄化,越橘提取物,口服美容",0,0,0,2024-07-30 17:53,微博 weibo.com,,,,,蓝V
5060446808181087,OpmuQykh1,2346733577,INSEAD欧洲工商管理学院,【#INSEAD校友#荣耀时刻！#AndrewDowling#的初创公司#Stitch.net#荣获联合国大奖】祝贺#清华-INSEAD工商管理硕士#项目(#TIEMBA#)杰出校友安德鲁.道林(AndrewDowling)创办的Stitch.net荣获#联合国健康老龄化影响力奖#！这一殊荣不仅是对安德鲁社会创新精神的认可，更是对Stitch.net团队不懈努力的最高赞誉。安德鲁的创业之旅，始于TIEMBA课堂上的一个#“AhaMoment”#。在那堂由全球社会企业家精神领袖主讲的课上，灵感如火花般迸发，他深刻意识到减少孤独与社交孤立对于提升老年人生活质量的重要性。在联合创始人和其他TIEMBA同学的支持下，Stitch.net顺利诞生，旨在以科技为桥梁，温暖每一颗需要关怀的心。如今，Stitch.net已发展成为拥有23万+会员的全球性社区。通过科技力量与伦理考量，Stitch.net成功打造了友好的环境，挑战年龄偏见，重塑#健康老龄化#新篇章！你也想找到自己的#“灵光一闪”#吗？加入TIEMBA，开启你的非凡之旅吧！在这里，你将与来自世界各地的精英学子并肩，共同探索改变世界的无限可能。下一个改变行业、影响社会的你，或许就在这里启程！欢迎点击下方链接，探索更多TIEMBA项目信息：O网页链接#INSEAD##社会影响力##MBA##创新##健康老龄化##TIEMBA#,,,,"INSEAD校友,Andrew Dowling,Stitch.net,清华-INSEAD工商管理硕士,TIEMBA,联合国健康老龄化影响力奖,“Aha Moment”,健康老龄化,“灵光一闪”,INSEAD,社会影响力,MBA,创新",2,1,2,2024-07-26 18:00,微博网页版,"https://wx4.sinaimg.cn/large/8be05009gy1hry2vxq7n9j20kr0dpdl4.jpg,https://wx1.sinaimg.cn/large/8be05009gy1hry2wiqu45j21hc4ecu0x.jpg",,,,蓝V
5059573929216070,OoZMYCFwi,2486958021,牡丹陈敏,"最佳减重排行榜：哪种运动热量燃烧更高效？今日最新鲜健康资讯头条【2024.07.24】星期三 做自己#健康#的第一责任人。#新闻#1）人民日报：日前，《中国健康老龄化发展蓝皮书——积极应对人口老龄化研究与施策（2023-2024）》正式发布。以“积极老龄观、健康老龄化”为主题，剖析了积极应对老龄化面临的问题、机遇和挑战，提出了一系列理论观点和具有可操作性、可落地性的政策建议。#健康老龄化2）生命时报：近日，美国运动理事会列出了一份减重运动排行榜，跳绳以其高效燃脂效果位居榜首。其他高效减重运动依次为冲刺跑、跆拳道、动感单车和跑步等。减肥不宜操之过急，过快减重可能导致代谢问题。理想的减重目标是6个月内减少当前体重的5%-10%，每月减2-4公斤为宜。#科学运动3）新华网：生酮饮食是一种高脂肪、低碳水化合物的饮食方法，最初用于治疗难治性癫痫和肿瘤，但并不适合健康人群减重。专家建议，健康减重应遵循中国居民膳食指南，保持饮食多样化和均衡。健康减重的关键是控制饮食量和增加运动量，达到能量负平衡，不建议断食或完全不吃主食。#体重管理4）新华网：皮肤老化主要由紫外线引起，占外源性老化的80%。紫外线中，UVB影响表皮，造成皮肤变薄、角质增厚；UVA深入真皮，破坏胶原蛋白，导致皱纹和色斑。专家强调，抗光老化比单纯防晒更全面有效。它不仅能防止紫外线直接伤害，还能全面保护皮肤健康。因此，做好日常抗光老化护理，是保持皮肤年轻的关键。#健康丽颜5）《中国居民膳食营养素参考摄入量2023》：评价食物蛋白质营养价值主要从""量""和""质""两个方面进行。""质""的评价方法，可概括为生物学法和化学分析法。生物学法主要是通过动物或人体试验测定食物蛋白质在体内的消化率和利用率；化学分析法主要是通过对食物氨基酸分析，并与参考蛋白质相比较进行评价。#大健康观念【早安心语】突破自我，创造奇迹，成就非凡人生。早安！抗光老化比防晒更重要？把护肤新知转发给爱美的朋友！",,深圳,,"健康,新闻",0,1,0,2024-07-24 08:11,OPPO Reno9 Pro+ 5G,"https://wx3.sinaimg.cn/large/943bf7c5gy1hryt53yh5aj213m13mte6.jpg,https://wx2.sinaimg.cn/large/943bf7c5gy1hryt54dlgwj213m13mwii.jpg,https://wx2.sinaimg.cn/large/943bf7c5gy1hryt54tnn4j213m13mtd3.jpg",,,,普通用户
5053824451218588,OmAdD570E,2409958151,植提桥创新咨询,#美赞臣##每日悦享##成人营养##健康老龄化##心脏健康#美赞臣每日悦享两款跨境新品上市7月4日，美赞臣旗下成人营养品牌每日悦享AGIJOY推出了两款跨境新品PQQ麦角硫因4D冻龄胶囊及辅酶Q10橄榄叶护心澎湃胶囊，目前已在跨境电商平台上市。其中，PQQ麦角硫因4D胶囊含PQQ、麦角硫因、亚精胺和红石榴精粹等成分。辅酶Q10橄榄叶胶囊在产品中应用了1+1Cardiova复合配方，添加了高纯度的辅酶Q10和橄榄叶精粹。植观：成人营养市场，健康老龄化、心脏健康受到了品牌的重点关注。信息来源：美赞臣每日悦享,,,,"美赞臣,每日悦享,成人营养,健康老龄化,心脏健康",0,1,0,2024-07-08 11:25,微博网页版,,,,,蓝V
5053813332116424,OmzVH8SzS,2409958151,植提桥创新咨询,发布了头条文章：《日本市场新款健康老龄化产品，芝麻素是亮点》#营养健康##健康老龄化##芝麻提取物#O日本市场新款健康老龄化产品，芝麻素是亮点,http://t.cn/A6QnCHX0,,,"营养健康,健康老龄化,芝麻提取物",0,0,0,2024-07-08 10:40,微博 weibo.com,,,,,蓝V
5047295961206091,OjQnO53L5,6605842839,每日必看hot,银发力量：中老年人肌肉成长的潜力探索#运动新篇##锻炼时光##健康老龄化##赵之心运动哲学##健康#L每日必看hot的微博视频,,,,"运动新篇,锻炼时光,健康老龄化,赵之心运动哲学,健康",0,0,0,2024-06-20 11:03,微博视频号,,"http://f.video.weibocdn.com/o0/R2DIjBa6lx08fNknh57a01041200MUCu0E010.mp4?label=mp4_720p&template=720x1280.24.0&ori=0&ps=1BVp4ysnknHVZu&Expires=1725003582&ssig=bkh8sddq91&KID=unistore,video",,,红V
5041883791234336,OhzAv5b6E,2632954581,享瘦生活的海哥,🚀🌱中国步入中度老龄化，60岁前人口达2.6亿！👵👴🌟老年人的健康守护更应该得到关注！🍎🥦💪让更多人用科学营养获得来健康与快乐！🎉🎈🌈让生活更美好，从营养开始！🍽️💖#营养师的力量##健康老龄化##健康中国2030#,,广州·广州越秀国际会议中心,,"营养师的力量,健康老龄化,健康中国2030",0,0,0,2024-06-05 12:37,vivo X100 Pro,"https://wx3.sinaimg.cn/large/9cefb2d5gy1hqedenot2gj218o0u0n54.jpg,https://wx3.sinaimg.cn/large/9cefb2d5gy1hqedeodsshj20tw1lck2g.jpg",,,,普通用户
5040098939245193,OgP9HCN61,2409958151,植提桥创新咨询,发布了头条文章：《Nature刊发|花色苷营养功能和稳态化技术最新研究进展》#蓝莓花色苷##营养健康##眼健康##血糖健康##健康老龄化#ONature刊发|花色苷营养功能和稳态化技术最新研究进展,http://t.cn/A6HTbjmy,,,"蓝莓花色苷,营养健康,眼健康,血糖健康,健康老龄化",0,0,0,2024-05-31 14:24,微博 weibo.com,,,,,蓝V
5037492808713564,OfJmgAyNm,2409958151,植提桥创新咨询,发布了头条文章：《IFF推出面向更年期和及健康老龄化的解决方案》#更年期##健康老龄化##营养健康##iff#OIFF推出面向更年期和及健康老龄化的解决方案,http://t.cn/A6HKXfGE,,,"更年期,健康老龄化,营养健康,iff",0,1,0,2024-05-24 09:49,微博 weibo.com,,,,,蓝V
5036855768124861,OfsMMy5E9,6279607404,5点下线,老龄化的文章，在讲未来老龄人口带来的社会各方面压力增大。但是政府要知道，活得越久不一定是负担，超过65的人也是可以老当益壮，他们活长了的年份是健康的。可以工作的。可是，我们当初活得更久的愿望里面，没有想过代价是会给社会和年轻人增加负担，而是希望能过有更长更快乐的退休时光。#健康老龄化#,,,,健康老龄化,0,1,0,2024-05-22 15:37,iPhone客户端,,,,,普通用户
5036787624054054,Ofr0Sh0DY,2632954581,享瘦生活的海哥,朱阿姨一个月的效果精气神杠杠哒[跳跳][转圈][跳跳]退休了整整的去感受健康才是最最重要毕竟大多数人都是年轻时用健康换钱#效果杠杠滴##健康中国2030##健康老龄化#,,深圳·大新前海商业中心,,"效果杠杠滴,健康中国2030,健康老龄化",0,0,0,2024-05-22 11:06,vivo X100 Pro,https://wx4.sinaimg.cn/large/9cefb2d5gy1hpy45atmraj20u00u0q98.jpg,,,,普通用户
5032785112730518,OdKTdbskC,2409958151,植提桥创新咨询,发布了头条文章：《新原料|瑞士原料商推出植物来源健康老龄化成分》#健康老龄化##香蜂草##美国薄荷#O新原料|瑞士原料商推出植物来源健康老龄化成分,http://t.cn/A6H4pTGC,,,"健康老龄化,香蜂草,美国薄荷",0,0,0,2024-05-11 10:02,微博 weibo.com,,,,,蓝V
5025192823492308,OaznAeEvy,5338167197,孔博BJTLCDC,#阳光长城慢病防治##健闻登顶计划#超重、肥胖和脂肪的过度积累与糖耐量异常、高血压、高血脂、脂肪肝等代谢性疾病的发生密切相关，而代谢性疾病是影响心血管系统、肾脏、肺、大脑的重要因素。健康老化的重点是“功能能力”，这是一个人所有身体和精神能力综合作用的结果。体重和胆固醇相关指标较差，将导致器官功能缺失和身体能力下降，从而加速机体老化。#健康老龄化#@首都健康@北京12320在聆听,,,"首都健康,北京12320在聆听","阳光长城慢病防治,健闻登顶计划,健康老龄化",0,0,0,2024-04-20 11:13,HUAWEI Mate 40 Pro,,,,,黄V
5021650445668317,O95e4nMAt,1434999734,郑育龙营养师,#健康老龄化#健康老龄化要掌握它的精髓，最重要的是主动健康，不是都寄托在医疗上。老年人要树立独立自强观、树立主动参与观、树立积极养老观，学习观老年人老了还要去干事，还要去做自己的爱好，这就是最好的养老。,,,,健康老龄化,1,0,1,2024-04-10 16:37,iPhone 13 Pro,https://wx1.sinaimg.cn/large/55885bb6ly1holtp74h9ij22c0340u10.jpg,,,,黄V
5009259823105449,O3STcd1RT,2737812790,香港贸发局,#展会前瞻#【#亚洲医疗健康高峰论坛2024#–重温去年论坛焦点！】第4届#亚洲医疗健康高峰论坛#(#ASGH#)将于5月16至17日盛大举行，促进#亚洲医疗健康#产业创新及投资交流！本届论坛汇聚商界领袖及医健专家，探索医疗行业创新机遇，并深入探讨#中国内地#最新医疗投资格局、#生物医学技术#、#健康老龄化#、#长寿科研#等热话题。马上重温去年高峰论坛的焦点概要，了解这盛事如何为与会者创造各种机遇！3月25日或之前登记，即可享五折优惠：O网页链接亚洲医疗健康高峰论坛：O网页链接日期：5月16–17日地点：香港会议展览中心,,,,"展会前瞻,亚洲医疗健康高峰论坛2024,亚洲医疗健康高峰论坛,ASGH,亚洲医疗健康,中国内地,生物医学技术,健康老龄化,长寿科研",0,0,1,2024-03-07 12:01,微博网页版,"https://wx2.sinaimg.cn/large/a32fb536gy1hnh4qs2s69j20xc0xc19b.jpg,https://wx4.sinaimg.cn/large/a32fb536gy1hnh4qrsl12j20xc0xck52.jpg,https://wx3.sinaimg.cn/large/a32fb536gy1hnh4qrwfdcj20xc0xc7ak.jpg,https://wx2.sinaimg.cn/large/a32fb536gy1hnh4qru2z7j20xc0xcgru.jpg",,,,蓝V
5003809505414943,O1B6mmIFN,2409958151,植提桥创新咨询,发布了头条文章：《增长120%！国内市场走低的肌酸，为何在北美市场出现高增长？》#肌酸##运动营养##脑健康##健康老龄化#O增长120%！国内市场走低的肌酸，为何在北美市场出现高增长？,http://t.cn/A6Y9bWr8,,,"肌酸,运动营养,脑健康,健康老龄化",0,0,0,2024-02-21 11:03,微博 weibo.com,,,,,蓝V
5003544704845927,O1udgkkE7,7844047914,时光派Hebe,#健康老龄化#【8年追踪发现：多做这几种活动更有益于健康老龄化丨抗衰速递2.20】伦敦大学学院的学者研究了不同领域的休闲活动对健康老龄化的益处。通过对8771名老年人进行长达八年的追踪，研究发现参与体力、创意、认知和社区活动可对老年人在多个领域的健康和功能（除心脏健康）带来正面影响。研究认为，体力和创意活动可能对老年人的重要衰老指标产生影响，减少年龄相关的衰退，并使老年人更长时间地保持功能独立。,,,,健康老龄化,0,0,0,2024-02-20 17:31,微博网页版,https://wx3.sinaimg.cn/large/008yQPbQgy1hn02a5fvljj30p00anjs3.jpg,,,,蓝V
5002681936511507,O17LHrjWj,1941818984,医道社,发布了头条文章：《健康老龄化十年：拥抱长寿并管理与年龄相关的慢性病》百岁老人被视为健康老龄化的缩影，表现出健康的表型和慢性病患病率较低的特点。研究这个群体为衰老生物标志物和机制提供了宝贵的见解。然而，世界各地对百岁老人的研究和前瞻性队列都很有限，这凸显出需要对这种健康老龄化的终极模型进行更全面的研究。总之，当我们迈入“健康老龄化十年”时，至关重要的是我们要重点了解有助于健康老龄化的因素，以及如何利用这些知识来管理老龄化人口中日益增长的慢性病负担。从了解人口趋势，到认识家庭、社区和内在能力在健康老龄化中的作用，再到向百岁老人学习，在我们迈向健康老龄化人口的道路上，还有很多东西需要探索和学习。长寿超话#抗衰老#抗衰老超话#健康老龄化#慢性病超话O健康老龄化十年：拥抱长寿并管理与年龄相关的慢性病,http://t.cn/A6YX1oCn,,,"抗衰老,健康老龄化",0,0,0,2024-02-18 08:23,微博 weibo.com,,,,,蓝V
4995130304758343,NDULYjXRt,1990016933,辛舒医生,#健康早头条#【2024.01.28】星期日健康早头条，做自己健康的第一责任人。1）新华社：冬季是心血管疾病和呼吸道疾病的高发季节。心血管疾病患者更易出现血液黏稠度增加，血液循环减慢，出现血栓。一旦感染了呼吸道疾病，可能会加重病情。建议患基础疾病人群增强免疫力、做好基础防护，保暖、多休息、保持健康饮食。#安全第一2）中国青年报：寒假来临，很多医院的内分泌科都迎来了一波就诊小高峰，许多家长趁着学校放假，带孩子来治疗“肥胖”。近年来，许多“成年病”开始出现年轻化、低龄化趋势，肥胖是不可低估的诱因。春节假期，家长要培养孩子饮食规律，早餐注重营养，午餐食物种类要丰富，晚餐尽量少吃，每餐七八分饱即可。#合理膳食3）搜狐健康：营养是健康的基石，缺乏营养就难以塑造强健的体魄，对老年人来说更是如此。然而，在现实生活中，由于种种原因，老年人的营养状况并不理想。老年人营养不良会损害生理功能，降低免疫力，严重的还会引起并发症。近期体重下降或消瘦，肌肉力量变差，头发易断、易脱发，皮肤粗糙干燥、褶皱加重，眼睛发红发炎、视力下降，嘴角干裂，认知功能下降，以上七大表现都是营养不良的警告。#健康老龄化4）科技日报：大量科学研究显示，健康的生活方式可以预防或推迟多种慢性病疾病的发生。尽管这些疾病症状多种多样，但却拥有一个共同的特征，那就是它们都与肥胖有着密切的关系，所以只要保持健康的体重，在很大程度上就掌握了健康的主动权。保持健康体重，不仅让外表美丽，更对健康有着重要意义。#体重管理5）《营养素》杂志：大蒜可预防癌症，从大蒜素转化而来的二烯丙基三硫化物可以抑制芳香烃受体的活性，减少DNA损伤，抑制活性氧形成，同时还能增加DNA修复的能力，防止癌变。#充足观念,,,,健康早头条,0,0,0,2024-01-28 12:15,HUAWEI Mate 30,,,,,黄V
4995108420453962,NDUcG1U5Y,2486958021,牡丹陈敏,七大表现提示老年营养不良今日最新鲜健康资讯头条【2024.01.28】星期日 做自己#健康#的第一责任人。#新闻#1）新华社：冬季是心血管疾病和呼吸道疾病的高发季节。心血管疾病患者更易出现血液黏稠度增加，血液循环减慢，出现血栓。一旦感染了呼吸道疾病，可能会加重病情。建议患基础疾病人群增强免疫力、做好基础防护，保暖、多休息、保持健康饮食。#安全第一2）中国青年报：寒假来临，很多医院的内分泌科都迎来了一波就诊小高峰，许多家长趁着学校放假，带孩子来治疗“肥胖”。近年来，许多“成年病”开始出现年轻化、低龄化趋势，肥胖是不可低估的诱因。春节假期，家长要培养孩子饮食规律，早餐注重营养，午餐食物种类要丰富，晚餐尽量少吃，每餐七八分饱即可。#合理膳食3）搜狐健康：营养是健康的基石，缺乏营养就难以塑造强健的体魄，对老年人来说更是如此。然而，在现实生活中，由于种种原因，老年人的营养状况并不理想。老年人营养不良会损害生理功能，降低免疫力，严重的还会引起并发症。近期体重下降或消瘦，肌肉力量变差，头发易断、易脱发，皮肤粗糙干燥、褶皱加重，眼睛发红发炎、视力下降，嘴角干裂，认知功能下降，以上七大表现都是营养不良的警告。#健康老龄化4）科技日报：大量科学研究显示，健康的生活方式可以预防或推迟这些疾病的发生。尽管这些疾病症状多种多样，但却拥有一个共同的特征，那就是它们都与肥胖有着密切的关系，所以只要保持健康的体重，在很大程度上就掌握了健康的主动权。保持健康体重，不仅让外表美丽，更对健康有着重要意义。#体重管理5）《营养素》杂志：大蒜可预防癌症，从大蒜素转化而来的二烯丙基三硫化物可以抑制芳香烃受体的活性，减少DNA损伤，抑制活性氧形成，同时还能增加DNA修复的能力，防止癌变。#充足观念 【早安心语】如果你看到面前的阴影，别怕，那是因为你的背后有阳光。早安！健康知识轻松get，转发朋友圈多多收获like！,,深圳,,"健康,新闻",0,1,0,2024-01-28 10:48,OPPO Reno9 Pro+ 5G,https://wx2.sinaimg.cn/large/943bf7c5gy1hm95dtm4s3j20rs18gkjl.jpg,,,,普通用户
4994103864986178,NDu4qkV8e,7727144419,香港科技大学,#港科大快讯#在今年备受瞩目的世界经济论坛年会“冬季达沃斯”上，香港科技大学校长叶玉如教授与来自不同国家及地区的代表深入探讨全球重大议题，就健康老龄化、气候变化对全球带来的挑战，以及大学于推动可持续发展和人工智能在研究与教育中的角色，分享精辟见解。作为香港高教界唯一获邀出席活动的大学校长，叶教授参与了多场重要的交流活动，当中包括关注人口变化，探索人类长寿之路的专题研讨会。她指出，随着年龄增长，维持#大脑健康#及生活品质，至为重要。叶教授表示：“我们不仅追求更长寿，亦应增添有生命力的岁月。在延龄增寿之馀，更重要的是保持思维清晰、充满活力，并能为社会作出有意义的贡献。”作为一位全球知名的神经科学家，叶教授在阿尔茨海默症（AD）预测、诊断和治疗领域取得卓越成就。其中，她的研究团队成功研发了一个简单而可靠的血液检测方法，能及早筛查并识别AD患者，为应对这项全球重大健康挑战贡献良多。叶教授亦以联席主持人的身份出席了一场晚宴，与来自不同领域的专家交流，从科学、文化和企业的角度，探讨如何合作发挥协同效应，应对气候变化所带来的迫切挑战。此外，在另一场探讨AI管治的「环球大学领袖论坛」（GULF）会议中，叶教授强调大学在设计和推动AI相关课程时，应全面涵盖包括伦理教育、社会影响和治理政策等主题。她在总结是次行程时表示，非常荣幸能参与此重要盛会，表示世界充满不确定性和挑战，大学应担当关键的角色，透过推动多方面的协作，为更美好的社会努力。了解更多：O网页链接#健康老龄化##健康生活##研究##神经科学##人工智能##伦理##领导力##科学##创新##大脑健康#WEF##冬季达沃斯##全球气候挑战##人口变化##健康老龄化##老龄化问题#,,,,"港科大快讯,大脑健康,健康老龄化,健康生活,研究,神经科学,人工智能,伦理,领导力,科学,创新,大脑健康 ",0,0,3,2024-01-25 16:16,微博网页版,https://wx4.sinaimg.cn/large/008qWjfBgy1hm5y0iwpv5j30x30x3dle.jpg,,,,蓝V
