id,bid,user_id,用户昵称,微博正文,头条文章url,发布位置,艾特用户,话题,转发数,评论数,点赞数,发布时间,发布工具,微博图片url,微博视频url,retweet_id,ip,user_authentication
4615787060401864,K6CH01GxG,3097295767,小熊饼干和我,《失能=失去健康（11）》不是说跳舞不好，瑜伽不好，运动最主要的功能和评价指标就是心肺功能和肌肉量，运动后心率下降了吗，肺活量增加了吗？肌肉增加了吗？运动要增加肺活量，提高心肺从环境当中获得氧气的能力，你是不是遇到这样的人，在拥挤的公交车上感觉呼吸不畅，不管什么季节，都喜欢开窗，不开窗有憋闷感，毫无疑问，他的心肺能力比另外一些没有任何感觉的人变差了，从一个缺氧的环境获取氧气的能力不足。运动要减慢心率，哺乳动物的心率比较恒定，一辈子都是跳8亿次，跳完完事了，老鼠用了750天就跳完了，大象用了75年才跳完，毫无疑问让心率慢一点，就可以跳的久一些。经常运动的人不运动的时候心率会慢很多，跳一下是一下，效率很高的。两个年龄体重相当的成年人，运动的要比不运动的人心率每分钟少20-30次，一天少多少次呢？一年少多少次呢？20年少多少次呢？30年呢？运动要增加肌肉量，随着年龄增长，肌肉在流失，流失到最后就连鼓起肺的力量都没有了，呼吸都变得无比艰难。要想慢一点老，要想逆生长，要想健康的长寿，要想老来不失能，必须增加肌肉量。肌肉增长有个特点，就是要用超过肌肉最大负荷的重量，去让肌肉超负荷、肌纤维破裂，然后长出更强更大块更能负重的肌肉，然后，再来一轮，更重的重量上，继续让肌肉超负荷、肌纤维破裂，继续长出更强，更大，更能负重的肌肉来。肌肉还是用进废退，不经常用大重量去刺激它，它就流失！反过来想呢，也有一个好处，就是那些辛辛苦苦练出点肌肉的人，根本不敢怠慢，为了不让自己曾经的汗水白流，那就继续流更多的汗水；一阵子健身，一辈子健身。女性比男性天生脂肪量高，肌肉量少，缺少有力量的肌肉的保护，女性骨关节疾病更多见，肌肉强大了，关节的压力负荷就小了，增加肌肉是对骨骼，关节最好的保护，没有之一。负重运动对骨骼也有刺激，让骨骼沉积更多的矿物质，增加骨头的强度，减缓骨质流失的速度，预防骨质疏松和骨折，骨质疏松和骨折也是老年人摔倒，瘫痪，失能的原因之一。    增肌，女性比男性更迫切！#有效运动##无效运动##增肌##负重运动##骨质疏松##骨折##失能老人##中国失能老人超4000万##女性增肌##哺乳动物一生心跳8亿次#,,北京·富海国际港,,"有效运动,无效运动,增肌,负重运动,骨质疏松,骨折,失能老人,中国失能老人超4000万,女性增肌,哺乳动物一生心跳8亿次",1,0,2,2021-03-17 17:20,HUAWEI P30,https://wx1.sinaimg.cn/large/b89cfb97ly1gon0tjyjsyj20hs0a4nbt.jpg,,,,普通用户
4615046787239504,K6jr0unkc,5518001908,银河正在靠近仙女系,我40+，父母70。看完#失能老人#在#养老院#的处境，我有点想定期去养老院给他们撑撑腰、给护工们发点红包啥的。然后数了一下可能有需求的长辈们：先是父母公婆，这四个人我铁定要管。然后我有一个姨无孩、另有姑姑丧偶独女定居海外、二舅家的女儿不是亲生、舅舅舅妈离婚后跟女儿几乎无来往。一共是7个老人。这些长辈们都对我很好，闭上眼睛还是我童年时他们给我买东西吃、带我去公园的画面。但是7个老人，也真是让人心有余而时间不够分配的啊。我乐观一点估计——二舅的女儿管她爹，那么还剩下6个老人。再乐观点，我家4老中一至二人跳过失能阶段直接那啥，剩下的同时失能，我集中接到家里护理或者送进同一个养老院。我还有余力照顾去养老院给姨和姑姑撑腰吗？大概率我是顾不上的。我也不想生活被照顾老人填满。那些说自己无孩不要紧、可以让侄子女、外甥子女帮忙的，人家也有四老要照顾的。到时候你的侄子女、外甥子女可能也忙不过来啊。,,,,"失能老人,养老院",0,1,1,2021-03-15 16:19,微博 weibo.com,,,,,普通用户
4614723784675777,K6b22jCnL,3097295767,小熊饼干和我,《失能=失去尊严（1）》周末是我的劳动改造日，我用抹布扫荡每个房间的每个角落。    擦到客厅时，来找奶奶聊天的梁阿姨突然兴高采烈地对我说：“张医生，你说82岁的老爷子还能活几年？身体挺好，啥毛病没有。”    我愣住了，有这么聊天的吗？一般的亲戚朋友来我家咨询，都是抹着眼泪红着眼睛无比期待地问：“张大夫，您说老人家还能活多久？”    梁阿姨是婆婆在老家时候的邻居，来北京做保姆五年，专门照顾老人，每个月两天休息，总会找时间来我家坐一会儿。早些年东北女人很少出来打工，像梁阿姨这种快50岁的女人出来打拼，还是干伺候老人这种谁都不愿意干的活，实属无奈。    她没念过书，不愿意干农活， 一心想嫁城里人改头换面。经人介绍，认识一个有城镇户口的男人，两人才见两面儿，手都没拉过就直接进了洞房。梁阿姨离开泥巴地和农家活，却陷入和农村并没有本质区别的，小城市的贫苦和困顿。梁阿姨的妈有抽风病，常年癫痫大发作，早就成了废人，连出嫁前给她讲讲最基本的夫妻之事的人都没有。她完全不懂避孕，20岁出头，正处于性活跃年龄，也是女性生育能力的最高峰，很快就怀孕了。即使经历过相当一段时间的自由恋爱，结婚后锅碗瓢盆的生活还是会让很多人发现，枕边人根本不适合一起过日子，何况这样经人介绍的“闪婚“？那以后，不管是正怀孕、坐月子还是奶孩子，两人没断过吵架。梁阿姨想过离婚，但是自己户口还没落下，又没正式工作，离婚后只能回娘家白吃白住，就断了这念头。    当年自己心高气傲，一心想进城，十里八村多少人给介绍对象，她都一口回绝，如今落到这个下场，怎么有脸回老家，怎么面对父老乡亲？    离婚本来可能让她的生活获得转机，却因为经济不独立，没勇气一个人生活，再加上舍不得孩子，又过度在意周围人的看法，离婚这事儿，也就只能是想想。    其实大家都很忙，不管是善意还是恶意，哪有人整天关注你那些事儿，天后离婚最多也就上三天头条。女人，关键的时候千万不要太把自己当人，丢掉各种玻璃心，豁得出去一时才能重获新生，该断不断，都是后患，最终只能委曲求全，一辈子过那种不把自己当人的生活。梁阿姨的男人不光矮穷丑，还抽大烟喝大酒，46岁那年，酒后醉在田埂上睡了一宿，冻死了。三个儿子都不好好读书，母亲的温良恭俭让在他们眼里都是软弱可欺，对他们的品质毫无正面影响。老大喝酒赌钱，整天有人追他妈屁股后头要账；老二三天两头下岗，动不动单位集资就伸手要钱；只有老三不烦她，混黑社会早早关进去了。梁阿姨下决心离开这个让自己大半生不幸的小城镇，到北京闯一闯。其实，与其说是闯一闯，不如说是躲一躲。 梁阿姨最近换了一家新雇主，照顾一位82岁的老爷子，他的两个女儿觉得梁阿姨人不错，希望保姆嫁给她们的爸爸。 摘自协和医院妇科医生张羽的《只有医生知道-3》，建议大家阅读！#中国失能老人超4000万##失能老人##协和医院妇科##妇科肿瘤专家张羽#只有医生知道3-张羽,,北京·富海国际港,,"中国失能老人超4000万,失能老人,协和医院妇科,妇科肿瘤专家张羽",1,0,2,2021-03-14 18:55,HUAWEI P30,https://wx1.sinaimg.cn/large/b89cfb97ly1gojmrsink2j20hs0a4nbt.jpg,,,,普通用户
4614690711536133,K6aaH6rCl,3097295767,小熊饼干和我,《欢迎来到养老院》家里没有照料失能来人的，也可以选择机构养老，养老院里的年轻护工提供照料服务。你知道养老院的护工多少工资吗？不到三千块一个月。一线城市高端豪华养老院，护工工资能到四五千。 你觉得这么多工资应该能招到什么层次的人才？但这些护工的工作强度却特别大，给老人穿衣，喂老人吃饭，给老人洗澡，服侍老人换尿不湿，端屎端尿。而且，一个护工对接多个老人。而且，高龄失能老人和人交流的能力都很差了，而且性格古怪，情绪多变，护工也是人，你觉得护工会有一个什么样的心态？你上班可以不开心，可以摸鱼，护工也会。照顾失能老人，比照顾小孩子难多了，而且一般人保姆愿意带孩子也不愿意照顾老人！感觉完全不同的，孩子代表着生长，勃发，一天比一天懂事，一天比一天能干；而老人代表着衰弱，失能，死亡，一天比一天弱，一天比一天老！现在养老院的管理很严格了，直接对老人施加暴力这种事已经基本不存在了。但你要求护工给老人提供温馨的情绪支持，这基本上是不可能的。老人是否开心，情感需求是否得到回应，这个没办法考核。护工的一切劳动，都主要围绕着清洁来进行，及时给老人换尿布，及时给老人房间扫地拖地等。老人，就像一个有声物品，每天被定期擦拭一番，只要把老人喂饱了，不让老人磕着碰着，干净没有异味，这一天就算功德圆满。最后，很多老人的目光，变得越来越呆滞。 #失能老人##养老院##中国失能老人超4000万# ,,北京·富海国际港,,"失能老人,养老院,中国失能老人超4000万",1,0,2,2021-03-14 16:44,HUAWEI P30,https://wx2.sinaimg.cn/large/b89cfb97ly1gojj0p6soyj20hs0a4nbt.jpg,,,,普通用户
4410208015399496,I4hyxmEEE,6010940593,全家康智慧养老,【巨硅科技·全家康|国家卫生健康委员会关于开展老年护理需求评估和规范服务工作的通知】为指导各地提供#老年护理服务#的医疗机构规范开展#老年护理#需求评估和服务工作，精准对接老年人特别是#失能老人#护理服务需求，提高老年人群健康水平和生活质量，卫健委发布关于开展老年护理需求评估和规范服务工作的通知。O巨硅科技·全家康|关于开展老年护理需求评估和规范服务工作的通知,,,,"老年护理服务,老年护理,失能老人",1,0,9,2019-08-28 10:23,微博 weibo.com,,,,,普通用户
4408411028339664,I3wOayZwI,7264776639,汇祥医养产业研究院,#失能老人的福音“长护险”好用吗？##失能老人##半失能老人##社保推出的一种社会保险#O失能老人的福音“长护险”好用吗？,,,,"失能老人的福音“长护险”好用吗？,失能老人,半失能老人,社保推出的一种社会保险",0,0,0,2019-08-23 11:22,专业版微博,,,,,普通用户
4390270889646245,HBSmcEtqB,6010940593,全家康智慧养老,【巨硅科技·全家康|一图读懂：广州市高龄重度失能老年人照护商业保险】广州印发实施《广州市高龄重度失能老年人照护商业保险实施方案（试行）》，从7月1日起广州户籍80周岁以上重度#失能老人#可享#商业化高龄照护险#，每人每月最高支付500元。O巨硅科技·全家康|一图读懂：广州市高龄重度失能老年人照护商业保险,,,,"失能老人,商业化高龄照护险",0,0,1,2019-07-04 10:00,微博 weibo.com,,,,,普通用户
3900778990930117,D0kgr3TXT,5181743516,安星财富,【外媒：中国形成空巢老人、失独老人等5类特殊群体】如果说大部分发达国家是“边富边老”或是“先富后老”，那么中国的老龄化则呈现出明显的“未富先老”特征。中国形成了#农村留守老人#、城市#空巢老人#、#失独老人#、#失能老人#、#候鸟老人#等五类特殊老年群体。O外媒:中国形成空巢老人、失独老人等5类特殊群体,,,,"农村留守老人,空巢老人,失独老人,失能老人,候鸟老人",0,0,2,2015-10-22 16:14,360安全浏览器,https://ww4.sinaimg.cn/large/005EG4ckgw1ex9zdz5cbcj30c808zaah.jpg,,,,普通用户
3900584014546730,D0fbXj4Om,1448448401,北京迈伟医疗律师团队,#微博新闻#【外媒:中国形成#空巢老人#失独老人等5类特殊群体】中国的#老龄化#呈现出明显的#未富先老#特征。同时由于经济发展、城乡分割、人口流动、家庭结构变革等多种原因，中国形成的是#农村留守老人#、#城市空巢老人#、#失独老人#、#失能老人#、#候鸟老人#等五类特殊老年群体O网页链接,,,,"微博新闻,空巢老人,老龄化,未富先老,农村留守老人,城市空巢老人,失独老人,失能老人,候鸟老人",3,1,0,2015-10-22 03:19,360新闻,https://ww1.sinaimg.cn/large/56559191jw1ex9cwps2ztj20dw09jt9k.jpg,,,,蓝V
3857567283920231,Co9AsgrPx,3170754411,江苏省老龄事业发展基金会,#失能老人#长期卧床不仅会使老人的四肢功能退化，出现褥疮，免疫力下降等诸多问题，还会严重危害老人的心理健康。一辆轮椅送给失能老人，可以帮助老人离开病床，“走出”房间，对老人身心健康都是十分有益的。近日，我基金会慰问了南京市一位贫困失能空巢老人，为老人送上了一辆轮椅。,,,,失能老人,0,0,1,2015-06-25 10:26,360安全浏览器,https://ww2.sinaimg.cn/large/bcfddf6bgw1etg4japjihj20go0citb6.jpg,,,,蓝V
3817318306151490,C7gwKpOhA,3170754411,江苏省老龄事业发展基金会,一根拐杖让失去能力的老人站起来，一辆轮椅让重度瘫痪的老人具备行动能力。让我们献出一份爱、一份祝福，帮助困难失能老人，让每一位失能老人失能不失落、失能不失爱，晚年更幸福！[品牌捐]关爱失能老人，让爱不失能,,,,,4,1,0,2015-03-06 08:51,微公益,,,,,
3822146281439099,C9i7O62nh,3170754411,江苏省老龄事业发展基金会,关爱失能老人，转发让爱传递~~当牙齿开始脱落，脸上的皱纹渐渐加深，“穿衣、上下床、上厕所、洗澡、室内走动”这些最基本的生活能力被剥夺，除了呼吸和咽食，一切都得依赖于别人……他们就是#失能老人#！他们备受煎熬，在生命的暮霭中艰难地寻求生存空间。,,,,失能老人,0,0,0,2015-03-19 16:35,360安全浏览器,,,3817318306151490,,蓝V
3822145639733449,C9i6LEQ77,3170754411,江苏省老龄事业发展基金会,上午，江苏省老龄事业发展基金会老年康复专业委员会的工作人员来到常州武进华家中滩组，走访慰问了90岁高龄的重度#失能老人#邱彩娣，并为她送上了一台崭新的轮椅。这台带有坐便器和吃饭小桌的轮椅可以大大方便老人的日常生活。O网页链接,,,,失能老人,0,0,0,2015-03-19 16:33,360安全浏览器,https://ww2.sinaimg.cn/large/bcfddf6bgw1eqb4h20gryj20go0b3q4x.jpg,,,,蓝V
3576439951788011,zw4yf7v8T,2091941632,苏州瑞兰海斯健康科技有限公司,#失能老人#第一次照顾失能老人，远非想的那么简单。老人大小便失禁，不小心就会弄脏裤子。收拾老人的脏裤子时，我恶心得吐了......O网页链接,,,,失能老人,0,0,0,2013-05-10 16:06,专业版微博,https://ww4.sinaimg.cn/large/7cb07f00jw1e4j9k8inbdj216z1okqju.jpg,,,,普通用户
3550628489891639,zlf4QFvgz,1894371930,凤凰网公益,#凤凰公益资讯#【中国老年人口数量达1.94亿占总人口的14.3%】我国第一部老龄事业发展蓝皮书《中国老龄事业发展报告（2013）》昨天在京发布。蓝皮书指出，随着人口老龄化以及老年人口高龄化的快速发展，我国#失能老人#的绝对规模在迅速增加。O网页链接（分享自@凤凰网公益）,,,凤凰网公益,"凤凰公益资讯,失能老人",1,1,0,2013-02-28 10:41,分享按钮,,,,,蓝V
3481119125566251,yy2hinm2f,2810911090,天和网,#失能老人#的#养老问题#已经成为一个社会问题，需要引起国家的高度重视。O网页链接,,,,"失能老人,养老问题",1,0,0,2012-08-20 15:15,周博通微博管家,https://ww4.sinaimg.cn/large/a78b1972jw1dw364c4inij.jpg,,,,普通用户
3481119125162317,yy2hilEXb,2771255980,天和智库,#失能老人#的#养老问题#已经成为一个社会问题，需要引起国家的高度重视。O网页链接,,,,"失能老人,养老问题",0,0,0,2012-08-20 15:15,周博通微博管家,https://ww3.sinaimg.cn/large/a52e02acjw1dw364bt3t1j.jpg,,,,普通用户
3476481680825194,yw5Dy3sFA,1665321685,中国孝基金,#失能老人#丧失生活自理能力的老人称为“失能老人”。按国际通行标准分析，吃饭、穿衣、上下床、上厕所、室内走动、洗澡6项指标，一到两项“做不了”定义为“轻度失能”，三到四项“做不了”定义为“中度失能”，五到六项“做不了”定义为“重度失能”。愿社会给予他们更多关注和关心.,,,,失能老人,6,2,0,2012-08-07 20:08,微博 weibo.com,https://ww2.sinaimg.cn/large/6342cad5gw1dvodikseu9j.jpg,,,,蓝V
