id,bid,user_id,用户昵称,微博正文,头条文章url,发布位置,艾特用户,话题,转发数,评论数,点赞数,发布时间,发布工具,微博图片url,微博视频url,retweet_id,ip,user_authentication
4753751418863785,LmyjPBbSh,2498526022,雁塔旅游,【新冠疫苗安全有效#老年人更应接种新冠疫苗#】L雁塔旅游的微博视频,,,,老年人更应接种新冠疫苗,0,0,0,2022-04-02 10:22,微博视频号,,"http://f.video.weibocdn.com/o0/XTGKVts4lx07UXgm23j2010412007rMP0E010.mp4?label=mp4_720p&template=720x1280.24.0&ori=0&ps=1BVp4ysnknHVZu&Expires=1725016102&ssig=86v9tbzQuO&KID=unistore,video",,,蓝V
4753733881170705,LmxRy4Uyl,2618630987,西安网,【新冠疫苗安全有效#老年人更应接种新冠疫苗#】L西安电视台官方微博的微博视频,,,,老年人更应接种新冠疫苗,1,0,0,2022-04-02 09:12,微博视频号,,"http://f.video.weibocdn.com/o0/BIMQhkzHlx07UWIzjnbi0104120082LN0E010.mp4?label=mp4_720p&template=720x1280.24.0&ori=0&ps=1BVp4ysnknHVZu&Expires=1725016102&ssig=h0kIQsYQq5&KID=unistore,video",,,
4753744065466311,Lmy7YmW2j,3206535077,西咸新区秦汉新城,【新冠疫苗安全有效#老年人更应接种新冠疫苗#】#疫情防控#,,,,"老年人更应接种新冠疫苗,疫情防控",0,0,0,2022-04-02 09:52,微博网页版,,,4753733881170705,,蓝V
4753744006481783,Lmy7SrccT,1455232643,西安网络广播电视台,【新冠疫苗安全有效#老年人更应接种新冠疫苗#】L西安电视台官方微博的微博视频,,,,老年人更应接种新冠疫苗,1,0,0,2022-04-02 09:52,iPhone客户端,,"http://f.video.weibocdn.com/o0/BIMQhkzHlx07UWIzjnbi0104120082LN0E010.mp4?label=mp4_720p&template=720x1280.24.0&ori=0&ps=1BVp4ysnknHVZu&Expires=1725016102&ssig=h0kIQsYQq5&KID=unistore,video",,,蓝V
4753713165503273,Lmxk8n5Et,2183542485,西安广播电视台,【新冠疫苗安全有效#老年人更应接种新冠疫苗#】L西安电视台官方微博的微博视频,,,,老年人更应接种新冠疫苗,1,0,1,2022-04-02 07:50,微博视频号,,"http://f.video.weibocdn.com/o0/BIMQhkzHlx07UWIzjnbi0104120082LN0E010.mp4?label=mp4_720p&template=720x1280.24.0&ori=0&ps=1BVp4ysnknHVZu&Expires=1725016102&ssig=h0kIQsYQq5&KID=unistore,video",,,蓝V
4725137314678302,LaxW3jD2u,1036183454,天坛健康科普,#如何预防新冠肺炎##健康科普#当前疫情防控形势严峻复杂，请广大公众时刻绷紧疫情防控的弦。疫情防控，点滴做起。北京天坛医院推出#预防新冠肺炎小贴士##老年人更应接种新冠疫苗#欢迎广大群众一起来学习。@我是天坛人@北京12320在聆听@首都健康@天坛体检孟莉@北京乳腺科杨大夫@天坛介入笔记@爱问健康说@北京丰台健康教育@北京市疾病预防控制中心L天坛健康科普的微博视频,,北京·北京天坛医院新址,"我是天坛人,北京12320在聆听,首都健康,天坛体检孟莉,北京乳腺科杨大夫,天坛介入笔记,爱问健康说,北京丰台健康教育,北京市疾病预防控制中心","如何预防新冠肺炎,健康科普,预防新冠肺炎小贴士,老年人更应接种新冠疫苗",2,0,1,2022-01-13 11:19,微博视频号,,"http://f.video.weibocdn.com/o0/000cqoymlx07SVoq7BRS010412003f4k0E010.mp4?label=mp4_hd&template=654x368.28.0&ori=0&ps=1BVp4ysnknHVZu&Expires=1725016102&ssig=xrC2SwYm5S&KID=unistore,video",,,普通用户
4715749421880045,L6BIi7T5j,3106743607,礼贤镇中心卫生院,市疾控专家李娟提示：老年人更应接种新冠疫苗@首都健康@健康大兴@北京市社区卫生服务管理中心#学党史办实事##科学就医我行动##老年人更应接种新冠疫苗#L礼贤镇中心卫生院的微博视频,,,"首都健康,健康大兴,北京市社区卫生服务管理中心","学党史 办实事,科学就医我行动,老年人更应接种新冠疫苗",0,0,2,2021-12-18 13:35,微博视频号,,"http://fb.video.weibocdn.com/o8/qLLtuEbblx07Sg4BAmR201041200q0mU0E018.mp4?label=mp4_720p&template=1280x720.25.0&trans_finger=1f0da16358befad33323e3a1b7f95fc9&ori=0&ps=1BVp4ysnknHVZu&Expires=1725016102&ssig=rDjKAuHRrh&KID=unistore,video",,,普通用户
